index,published,keyword,domain,language,valid,title,description,url,image,archive,content,quote,de,en,la,added
715c58540c43592ef79635ba87bb6659,2026-02-06T11:12:58Z,'earthquake',www.hurriyetdailynews.com,en,0.9,Cities in silent mourning as Türkiye remembers Feb 6 quakes,"Exactly three years to the minute after the first tremor, silence descended across 11 southern provinces as thousands gathered in darkness, holding vigils to honor the tens of thousands killed in the catastrophic Feb. 6, 2023 earthquakes.",https://www.hurriyetdailynews.com/cities-in-silent-mourning-as-turkiye-remembers-feb-6-quakes-218680,https://image.hurimg.com/i/hurriyet/75/200x200/6985ccb83f4eea9745284598.jpg,http://web.archive.org/web/20260207050107/https://www.hurriyetdailynews.com/cities-in-silent-mourning-as-turkiye-remembers-feb-6-quakes-218680,"ISTANBUL
Exactly three years to the minute after the first tremor, silence descended across 11 southern provinces as thousands gathered in darkness, holding vigils to honor the tens of thousands kil… [+2938 chars]",,"Städte in stiller Trauer, während Türkiye sich an die Erdbeben vom 6. Februar erinnert. Auf die Minute genau drei Jahre nach dem ersten Beben herrschte Stille in elf südlichen Provinzen, als sich Tausende in der Dunkelheit versammelten und Mahnwachen abhielten, um die Zehntausenden zu ehren, die bei den katastrophalen Erdbeben vom 6. Februar 2023 ums Leben kamen.","Cities in silent mourning as Türkiye remembers Feb 6 quakes. Exactly three years to the minute after the first tremor, silence descended across 11 southern provinces as thousands gathered in darkness, holding vigils to honor the tens of thousands killed in the catastrophic Feb. 6, 2023 earthquakes.","Urbes in tacito luctu sicut Türkiye meminit, 6 feb tremit. Prorsus tres annos usque ad minutum post primum tremorem silentium descendit per 11 provincias meridianas sicut milia in tenebris collecta, vigilias tenentes ad honorem decem milium occisorum in terrae motu calamitoso 6 febr. 2023.",2026-02-07 23:00:46+00:00
9258c901fe50efe414a4139bce7604ec,2026-02-06T12:02:53Z,'earthquake',en.antaranews.com,en,0.9,"Megathrust earthquake hits East Java, injures dozens in Pacitan","A shallow megathrust earthquake struck Pacitan City, East Java, early Friday, causing damage to homes and injuring at least 36 people, Indonesia&rsquo;s ...",https://en.antaranews.com/news/403326/megathrust-earthquake-hits-east-java-injures-dozens-in-pacitan,https://cdn.antaranews.com/cache/1200x800/2026/02/06/IMG-20260206-WA0001.jpg,http://web.archive.org/web/20260206165144/https://en.antaranews.com/news/403326/megathrust-earthquake-hits-east-java-injures-dozens-in-pacitan,"Jakarta (ANTARA) - A shallow megathrust earthquake struck Pacitan City, East Java, early Friday, causing damage to homes and injuring at least 36 people, Indonesia’s Meteorology, Climatology, and Geo… [+1808 chars]",,"Megathrust-Erdbeben erschüttert Ost-Java und verletzt Dutzende in Pacitan. Ein leichtes Megathrust-Erdbeben erschütterte am frühen Freitag Pacitan City, Ost-Java, verursachte Schäden an Häusern und verletzte mindestens 36 Menschen, Indonesiens ...","Megathrust earthquake hits East Java, injures dozens in Pacitan. A shallow megathrust earthquake struck Pacitan City, East Java, early Friday, causing damage to homes and injuring at least 36 people, Indonesia&rsquo;s ...","Megathrust terrae motus Orientem Javam pervenit, in Pacitano justos laedit. Terrae motus vadum megathrustam Pacitanam urbem, Orientem Javam, Veneris mane percussit, domos laedens et saltem 36 homines, Indonesia&rsquo;s ...",2026-02-07 23:00:46+00:00
6420ce2b103262397abc220b76c63571,2026-02-06T13:35:10Z,'earthquake',www.memeorandum.com,en,0.9,GOP's new fear: Losing the Senate in November (Alex Isenstadt/Axios),"Alex Isenstadt / Axios:
GOP's new fear: Losing the Senate in November … But a Democratic takeover of the Senate would be a political earthquake — and neuter his last two years in office. … - Operatives say they've reviewed polling that shows the GOP facing co…",https://www.memeorandum.com/260206/p37,https://images.axios.com/IrKyDW6k6z9wM1FDsNg_vSfI4IY=/0x0:3133x1762/1366x768/2026/02/06/1770339612416.jpg,,"memeorandum is an auto-generated summary of the stories that US political commentators are discussing online right now.
Unlike sister sites Techmeme and Mediagazer, it is not a human-edited news out… [+72 chars]",,"Die neue Angst der GOP: Verlust des Senats im November (Alex Isenstadt/Axios). Alex Isenstadt / Axios:
Die neue Angst der GOP: Verlust des Senats im November … Aber eine demokratische Übernahme des Senats wäre ein politisches Erdbeben – und würde seine letzten beiden Amtsjahre zunichtemachen. … – Aktivisten sagen, sie hätten Umfragen überprüft, die zeigen, dass die Republikaner mit einer Krise konfrontiert sind …","GOP's new fear: Losing the Senate in November (Alex Isenstadt/Axios). Alex Isenstadt / Axios:
GOP's new fear: Losing the Senate in November … But a Democratic takeover of the Senate would be a political earthquake — and neuter his last two years in office. … - Operatives say they've reviewed polling that shows the GOP facing co…","GOP novus timor: Senatum amittens mense Novembri (Alex Isenstadt/Axios). Alex Isenstadt / Axios
Novus timor GOP: Senatum amittens mense Novembri ... At susceptor senatus democraticus terrae motus politicus esset - et neuter eius biennio proximo in magistratu. ... - Operativa dicunt se peregi suffragium quod ostendit GOP adversus co…",2026-02-07 23:00:46+00:00
835bfbc184d8ac6251a8e494c25eb3c4,2026-02-06T14:00:27Z,'earthquake',politicalwire.com,en,0.9,Democratic Primary Season Kicks Off with an Earthquake,"Steve Kornacki: “There’s no official winner yet, but the Democratic primary for the special election in New Jersey’s 11th congressional district already amounts to a political earthquake in the state.” “In an improbable twist that not long ago might have been…",https://politicalwire.com/2026/02/06/democratic-primary-season-kicks-off-with-an-earthquake/,https://politicalwire.com/wp-content/uploads/2018/02/PW-podcast-logo.jpg,http://web.archive.org/web/20260206170743/https://politicalwire.com/2026/02/06/democratic-primary-season-kicks-off-with-an-earthquake/,"“There are a lot of blogs and news sites claiming to understand politics, but only a few actually do. Political Wire is one of them.”
 Chuck Todd, host of “Meet the Press”
“Concise. Relevant. To th… [+594 chars]",,"Die Vorwahlsaison der Demokraten beginnt mit einem Erdbeben. Steve Kornacki: „Es gibt noch keinen offiziellen Gewinner, aber die Vorwahlen der Demokraten für die Sonderwahl im 11. Kongressbezirk von New Jersey kommen bereits einem politischen Erdbeben im Bundesstaat gleich.“ „In einer unwahrscheinlichen Wendung, die noch vor nicht allzu langer Zeit hätte passieren können …“","Democratic Primary Season Kicks Off with an Earthquake. Steve Kornacki: “There’s no official winner yet, but the Democratic primary for the special election in New Jersey’s 11th congressional district already amounts to a political earthquake in the state.” “In an improbable twist that not long ago might have been…","Respublica Primary Season Kicks Off cum terrae motu. Steve Kornacki: ""Nihil adhuc victor officialis est, sed prima Democratica pro speciali electione in regione Concilii Novi Jersey iam politici terrae motus in civitate recidit."" ""In improbabili torquent quod non pridem fuisset...",2026-02-07 23:00:46+00:00
a4c9674cc554fd2d759fbc1a9e05ce41,2026-02-06T16:12:50Z,'earthquake',slashdot.org,en,0.9,Steve Kornacki: Democratic primary season kicks off with an anti-establishment earthquake - NBC News,"Steve Kornacki: Democratic primary season kicks off with an anti-establishment earthquakeNBC News Hard-fought New Jersey election too close to call, as Democrats debate over the party's futureNBC News New Jersey's special Democratic primary too early to callN…",https://slashdot.org/firehose.pl?op=view&amp;id=180747780,,http://web.archive.org/web/20160119174443/http://slashdot.org/firehose.pl?op=view,The Fine Print: The following comments are owned by whoever posted them. We are not responsible for them in any way.,,"Steve Kornacki: Die Vorwahlsaison der Demokraten beginnt mit einem Erdbeben gegen das Establishment – ​​NBC News. Steve Kornacki: Die Vorwahlsaison der Demokraten beginnt mit einem Erdbeben gegen das Establishment. NBC News Hart umkämpfte Wahlen in New Jersey sind zu kurz, um sie auszurufen, während die Demokraten über die Zukunft der Partei debattieren. NBC News New Jerseys Sondervorwahlen für die Demokraten sind zu früh für eine Ausrufung.","Steve Kornacki: Democratic primary season kicks off with an anti-establishment earthquake - NBC News. Steve Kornacki: Democratic primary season kicks off with an anti-establishment earthquakeNBC News Hard-fought New Jersey election too close to call, as Democrats debate over the party's futureNBC News New Jersey's special Democratic primary too early to callN…","Steve Kornacki: Respublica primaria temporum calcibus cum anti instauratione terrae motus - NBC News. Steve Kornacki: Respublica primaria temporum calcibus cum anti-constitutione terraemotusNBC News Hard-pugnavit Novam Jersey electionem nimis propinquam vocat, sicut Democratae disputant de futuro NBC News Novae Jersey speciali democraticae primae primae nimis mane ad callN…",2026-02-07 23:00:46+00:00
776db7ba9410187162e1a9277a3e7aca,2026-02-06T16:43:36Z,'earthquake',blog.livedoor.jp,en,0.9,【速報】嫌な揺れ方の地震,1:それでも動く名無し  2026/02/07(土) 00:58:58.81 ID:jyuuZ4220  でかい https://news.web.nhk/kishou-saigai/earthquake/,http://blog.livedoor.jp/itsoku/archives/62990003.html,https://livedoor.blogimg.jp/itsoku/imgs/d/8/d822431b-s.png,http://web.archive.org/web/20260206170921/http://blog.livedoor.jp/itsoku/archives/62990003.html,"1: 2026/02/07() 00:58:58.81 ID:jyuuZ4220
https://news.web.nhk/kishou-saigai/earthquake/
7: 2026/02/07() 00:59:16.59 ID:fqwLZgCO0
6: 2026/02/07() 00:59:16.53 ID:1U0Xp82u0
8: 2026/02/07() 00:59:18.… [+1741 chars]",,"【速報】嫌な揺れ方の地震. 1: 07.02.2026 00:58:58,81 ID: jyuuZ4220 で か い https://news.web.nhk/kishou-saigai/earthquake/",【速報】嫌な揺れ方の地震. 1:それでも動く名無し  2026/02/07(土) 00:58:58.81 ID:jyuuZ4220  でかい https://news.web.nhk/kishou-saigai/earthquake/,【速報】嫌な揺れ方の地震. 1:それでも動く名無し 2026/02/07(土) 00:58:58.81 ID:jyuuZ4220,2026-02-07 23:00:46+00:00
f0fdde5c883442127b0b5ca440177c1e,2026-02-06T17:00:27Z,'earthquake magnitude',scienceblog.com,en,0.9,"When the Sun Sneezes, Does Earth Crack?","ON New year's Day 2024, a magnitude 7.6 earthquake tore through Japan's Noto Peninsula. Hours before, the Sun had kicked up: a big solar flare pelting",https://scienceblog.com/when-the-sun-sneezes-does-earth-crack/,https://scienceblog.com/wp-content/uploads/2026/02/pexels-serkangonultas-17142572.jpg,,"ON New year’s Day 2024, a magnitude 7.6 earthquake tore through Japan’s Noto Peninsula. Hours before, the Sun had kicked up: a big solar flare pelting Earth’s atmosphere with charged particles. Just … [+3304 chars]",,"Wenn die Sonne niest, reißt die Erde dann auf? Am Neujahrstag 2024 erschütterte ein Erdbeben der Stärke 7,6 die japanische Halbinsel Noto. Stunden zuvor hatte die Sonne ihren Höhepunkt erreicht: eine große Sonneneruption prasselte nieder","When the Sun Sneezes, Does Earth Crack?. ON New year's Day 2024, a magnitude 7.6 earthquake tore through Japan's Noto Peninsula. Hours before, the Sun had kicked up: a big solar flare pelting","Cum Sol Sternet, Terra Crack Num. DE Novo anno 2024, magnitudo 7.6 terrae motus per Noto paeninsulam Iaponiae discidit. Horis ante, Sol calce ascendit: magna solaria saxea",2026-02-07 23:00:46+00:00
d2dfab0b9b468b32bcd0d7abfd8b73a5,2026-02-06T18:32:00Z,'earthquake',www.thestar.com.my,en,0.9,"Feature: 3 yrs on, Turkish people still struggling to recover from devastating earthquake",by Burak Akinci Read full story,https://www.thestar.com.my/news/world/2026/02/07/feature-3-yrs-on-turkish-people-still-struggling-to-recover-from-devastating-earthquake,https://cdn.thestar.com.my/Themes/img/newTsol_logo_socmedia.png,http://web.archive.org/web/20260206200659/https://www.thestar.com.my/news/world/2026/02/07/feature-3-yrs-on-turkish-people-still-struggling-to-recover-from-devastating-earthquake,"by Burak Akinci
 KAHRAMANMARAS, Türkiye, Feb. 6 (Xinhua) -- Three years have passed, yet Volkan Dalyan, a geological engineer from Kahramanmaras, a province in southern Türkiye, still can't shake th… [+3724 chars]",,"Feature: Drei Jahre später kämpft die türkische Bevölkerung immer noch darum, sich von dem verheerenden Erdbeben zu erholen. von Burak Akinci Lesen Sie die ganze Geschichte","Feature: 3 yrs on, Turkish people still struggling to recover from devastating earthquake. by Burak Akinci Read full story","Pluma: 3 ann on, populus Turcicus adhuc a vastitate terrae motus recuperare conabatur. by Burak Akinci Read full story",2026-02-07 23:00:46+00:00
0641f9906c058e988f5a4ea6eb4b63dc,2026-02-06T20:13:12Z,'earthquake',pypi.org,en,0.9,bimquake added to PyPI,"Python package for earthquake resilience assessment of masonry buildings, integrating IFC (Industry Foundation Classes) building information models with seismic hazard analysis and structural evaluation.",https://pypi.org/project/bimquake/,,,"A required part of this site couldnt load. This may be due to a browser
 extension, network issues, or browser settings. Please check your
 connection, disable any ad blockers, or try using a diffe… [+12 chars]",,"bimquake zu PyPI hinzugefügt. Python-Paket zur Bewertung der Erdbebenresistenz von Mauerwerksgebäuden, das IFC-Gebäudeinformationsmodelle (Industry Foundation Classes) mit seismischen Gefahrenanalysen und Strukturbewertungen integriert.","bimquake added to PyPI. Python package for earthquake resilience assessment of masonry buildings, integrating IFC (Industry Foundation Classes) building information models with seismic hazard analysis and structural evaluation.","bimquake additur ad PyPI. Involucrum Python propter terraemotuum mollitiam aestimatio aedificiorum structurarum, integratio IFC (Industry Foundation Classes) formas informationes aedificandi cum analysis aleae seismicae et structuris aestimationis.",2026-02-07 23:00:46+00:00
0b3e16d3e8e9e0454548930c8c3b59b5,2026-02-05T15:42:13Z,'earthquake early warning',www.barchart.com,en,0.3,The Move in AMD Stock After Earnings Was Much Larger Than the Average. Why?,AMD stock crashed much more than the options market implied or what is historically observed after the company’s earnings. Find out why.,https://www.barchart.com/story/news/49055/the-move-in-amd-stock-after-earnings-was-much-larger-than-the-average-why,https://s.yimg.com/os/en/barchart_com_477/8c9fe72d2bcfa918279e7f77cd4abbe9,http://web.archive.org/web/20260206225311/https://www.barchart.com/story/news/49055/the-move-in-amd-stock-after-earnings-was-much-larger-than-the-average-why,"Investors expecting a standard post-earnings shimmy from Advanced Micro Devices (AMD) stock were instead met with a full-blown earthquake this week.
Heading into the earnings print, options market b… [+1869 chars]",,"The Move in AMD Stock After Earnings Was Much Larger Than the Average. Warum?. AMD stock crashed much more than the options market implied or what is historically observed after the company’s earnings. Finden Sie heraus, warum.",The Move in AMD Stock After Earnings Was Much Larger Than the Average. Why?. AMD stock crashed much more than the options market implied or what is historically observed after the company’s earnings. Find out why.,Movere in Intel Stock Post CAPTURA multo maior quam averis. Quare?. AMD truncus increpuit multo plus quam mercatus optiones implicatas vel quod historice observatum est post quaestus societatis. Cur reperi.,2026-02-08 05:50:35+00:00
ffe0bfe9ae69728aca8796ce10df22ac,2026-02-05T23:52:07Z,'earthquake early warning',www.nzherald.co.nz,en,0.3,Parents are responsible for raising their children – Letters to the Editor,OPINION: The Natural Hazards Commission should insure property against disasters.,https://www.nzherald.co.nz/nz/parents-are-responsible-for-raising-their-children-letters-to-the-editor/premium/SZK2LMGEMBFOZML7RZCU5LAUXI/,https://www.nzherald.co.nz/resizer/v2/LYWRIF7BAZH5RNHA6JJTT3IHS4.jpg?auth=f8b80d86178e3c12281ccf7a33ea2a70dd16d7f67a8dd5653924d1b3573a14e9&width=1200&height=675&quality=70&smart=true,http://web.archive.org/web/20260206000813/https://www.nzherald.co.nz/nz/parents-are-responsible-for-raising-their-children-letters-to-the-editor/premium/SZK2LMGEMBFOZML7RZCU5LAUXI/,"The value of good-quality ECE is undeniable, but to imply that an early child education centre is a substitute for parental responsibility demonstrates societal failure at a basic level.
Bernard Wal… [+8212 chars]",,Eltern sind für die Erziehung ihrer Kinder verantwortlich – Leserbriefe. MEINUNG: Die Natural Hazards Commission sollte Eigentum gegen Katastrophen versichern.,Parents are responsible for raising their children – Letters to the Editor. OPINION: The Natural Hazards Commission should insure property against disasters.,Parentes responsales sunt filios educandi – Epistulae ad Editorem. OPINIO: Commissio Periculosa Naturalis res contra clades praecavendas debet.,2026-02-08 05:50:35+00:00
29b762a5abf3ed3155959d71c881f85b,2026-02-06T00:00:00Z,'earthquake early warning',www.nature.com,en,0.3,Topological mechanical metamaterial for robust and ductile one-way fracturing,"An architected structural material can steer cracks in a single direction, turning brittle fractures into predictable and ductile processes through topological mechanics, offering a robust route to programmable, safer failure across materials and scales.",https://www.nature.com/articles/s41467-026-69026-7,,,"<li>Allegre, C. J., Le Mouel, J. &amp; Provost, A. Scaling rules in rock fracture and possible implications for earthquake prediction. Nature297, 479 (1982).
Google Scholar 
</li><li>Peterlik, H., … [+12966 chars]",,"Topologisches mechanisches Metamaterial für robuste und duktile Einwegfrakturierung. Ein strukturiertes Strukturmaterial kann Risse in eine einzige Richtung lenken und spröde Brüche durch topologische Mechanik in vorhersehbare und duktile Prozesse umwandeln. Dies bietet einen robusten Weg zu programmierbarem, sichererem Versagen über Materialien und Größenordnungen hinweg.","Topological mechanical metamaterial for robust and ductile one-way fracturing. An architected structural material can steer cracks in a single direction, turning brittle fractures into predictable and ductile processes through topological mechanics, offering a robust route to programmable, safer failure across materials and scales.","Metamateria mechanica topologica pro robusto et ductili uno modo fracto. Materia fabrica architectata rimas in unam partem dirigere potest, fragilis fracturas convertens in processibus praedictis et ductilis per mechanicas topologicas, validum iter praebet ad programmabilem, tutiorem defectum per materias et squamas.",2026-02-08 05:50:35+00:00
4620ecf46cd25dd7a9b9e29f4f1f5c94,2026-02-06T01:30:00Z,'earthquake early warning',www.irishtimes.com,en,0.3,Podcasting in China: ‘No sex or politics. Otherwise nearly everything is okay’,"Podcasts are booming in China, with an audience that grew by more than 43% in 2024",https://www.irishtimes.com/world/asia-pacific/2026/02/06/podcasting-in-china-no-sex-or-politics-otherwise-nearly-everything-is-okay/,https://www.irishtimes.com/resizer/v2/2AQRGFGJQVAXZBV7KM4N4XU75Y.jpg?smart=true&auth=9a4815941f44b6fcd3bcc34a34a155fbcbbf3b9ba052be5d6ff267ac42d62ac0&width=1200&height=630,http://web.archive.org/web/20260206112726/https://www.irishtimes.com/world/asia-pacific/2026/02/06/podcasting-in-china-no-sex-or-politics-otherwise-nearly-everything-is-okay/,"It had been a while since Id heard from Zhiqiang when he sent me a link with a video showing him and two others, a man and a woman, sitting around a table and swaddled in long down coats, woolly hats… [+4522 chars]",,"Podcasting in China: „Kein Sex oder Politik.“ Ansonsten ist fast alles in Ordnung.“ Podcasts boomen in China, das Publikum ist im Jahr 2024 um mehr als 43 % gewachsen","Podcasting in China: ‘No sex or politics. Otherwise nearly everything is okay’. Podcasts are booming in China, with an audience that grew by more than 43% in 2024","Podcasting in Sinis: 'Nullus sexus vel politicus'. Aliter fere omnia bene sunt. Podcasts sonabant in Sinis, audientia quae plus quam 43% in 2024 crevit",2026-02-08 05:50:35+00:00
75d10e36f4b013b83744fd2bb0bed9dc,2026-02-05T23:00:24Z,'earthquake',dailyreckoning.com,en,0.7,A Geopolitical Earthquake,"This post A Geopolitical Earthquake appeared first on Daily Reckoning.
Flipping the geopolitical chessboard…
The post A Geopolitical Earthquake appeared first on Daily Reckoning.",https://dailyreckoning.com/a-geopolitical-earthquake/,https://dailyreckoning.com/wp-content/uploads/2026/02/dr-hero-img-02-05-26.jpg,http://web.archive.org/web/20260206023521/https://dailyreckoning.com/a-geopolitical-earthquake/,"Our specialty is forecasting. We use multiple branches of science in our predictive analytic models including complexity theory, behavioral psychology, Bayes Theorem, neural networks (a form of artif… [+7715 chars]",,"Ein geopolitisches Erdbeben. Dieser Beitrag „Ein geopolitisches Erdbeben“ erschien zuerst auf Daily Reckoning.
Das geopolitische Schachbrett umdrehen…
Der Beitrag „Ein geopolitisches Erdbeben“ erschien zuerst auf Daily Reckoning.","A Geopolitical Earthquake. This post A Geopolitical Earthquake appeared first on Daily Reckoning.
Flipping the geopolitical chessboard…
The post A Geopolitical Earthquake appeared first on Daily Reckoning.","Terrae motus Geopolitical. Haec post Terrae motus Geopoliticus primus in Computatione Daily apparuit.
Flipping LATRUNCULARIA geopolitica...
Posta Geopoliticus Terrae motus primus in Daily Rationem apparuit.",2026-02-08 05:50:35+00:00
a80c72fb1db7d7b2ad855eded6922d9f,2026-02-05T20:43:36Z,'earthquake',pypi.org,en,0.9,SKHASH 1.1.5,Python package for earthquake focal mechanism inversions,https://pypi.org/project/skhash/1.1.5/,,,"A required part of this site couldnt load. This may be due to a browser
 extension, network issues, or browser settings. Please check your
 connection, disable any ad blockers, or try using a diffe… [+12 chars]",,SKHASH 1.1.5. Python-Paket für die Umkehrung von Erdbeben-Fokalmechanismen,SKHASH 1.1.5. Python package for earthquake focal mechanism inversions,SKHASH 1.1.5. Python sarcina terrae motus arx mechanismum inversiones,2026-02-08 05:50:35+00:00
f2e0e212fad6904c1b9a9b650789c5df,2026-02-05T22:15:00Z,'earthquake',www.discovermagazine.com,en,0.9,"Earthquakes Don’t Just Break the Crust, 459 Were Found Deep in the Mantle","Learn how seismic waves helped identify rare mantle earthquakes deep below Earth’s crust, offering new insight into the planet’s interior.",https://www.discovermagazine.com/earthquakes-don-t-just-break-the-crust-459-were-found-deep-in-the-mantle-48650,https://cdn.discovermagazine.com/assets/image/58517/earthquake-crack-x.jpg,http://web.archive.org/web/20260206000905/https://www.discovermagazine.com/earthquakes-don-t-just-break-the-crust-459-were-found-deep-in-the-mantle-48650,"Earthquakes are typically understood as fractures in the planets crust, where tectonic plates grind and strain until rock gives way. But some quakes begin much deeper than those familiar fault lines.… [+4273 chars]",,"Erdbeben brechen nicht nur die Erdkruste, 459 wurden tief im Erdmantel gefunden. Erfahren Sie, wie seismische Wellen dabei halfen, seltene Erdmantelbeben tief unter der Erdkruste zu identifizieren und neue Einblicke in das Innere des Planeten zu gewinnen.","Earthquakes Don’t Just Break the Crust, 459 Were Found Deep in the Mantle. Learn how seismic waves helped identify rare mantle earthquakes deep below Earth’s crust, offering new insight into the planet’s interior.","Terrae motus Don't Just Break Crust, 459 Deep in Mantlio reperti sunt. Disce quomodo seismic fluctus adiuverunt recognoscendas raras terrae motus mantellos profundos sub crusta Telluris, novam intuitionem in interiorem planetae praebentes.",2026-02-08 05:50:35+00:00
