index,published,keyword,domain,language,valid,title,description,url,image,archive,content,quote,de,en,la,added
00965996423f694748b9b121d0c27502,2025-10-17T19:55:45Z,'earthquake magnitude',biztoc.com,en,0.9,Earthquake Strikes Colorado South of Denver Today: USGS,"A magnitude 3.0 earthquake struck 13 kilometers southwest of Elbert, Colorado, on Friday afternoon, briefly rattling communities across El Paso and Douglas counties, causing no immediate reports of damage.
This story is breaking. More to follow.
A magnitude 3…",https://biztoc.com/x/0cf46034bbcb8e28,https://biztoc.com/cdn/0cf46034bbcb8e28_s.webp,,"A magnitude 3.0 earthquake struck 13 kilometers southwest of Elbert, Colorado, on Friday afternoon, briefly rattling communities across El Paso and Douglas counties, causing no immediate reports of d… [+139 chars]",,"Erdbeben erschüttert heute Colorado südlich von Denver: USGS. Ein Erdbeben der Stärke 3,0 erschütterte am Freitagnachmittag 13 Kilometer südwestlich von Elbert, Colorado, und erschütterte kurzzeitig Gemeinden in den Landkreisen El Paso und Douglas, ohne dass unmittelbar Schäden gemeldet wurden.
Diese Geschichte ist bahnbrechend. Weitere folgen.
Eine Stärke 3…","Earthquake Strikes Colorado South of Denver Today: USGS. A magnitude 3.0 earthquake struck 13 kilometers southwest of Elbert, Colorado, on Friday afternoon, briefly rattling communities across El Paso and Douglas counties, causing no immediate reports of damage.
This story is breaking. More to follow.
A magnitude 3…","Terrae motus Ictus Colorado Australis of Denver Hodie: USGS. Magnitudo 3.0 terrae motus XIII chiliometrorum ab Elbert inter meridiem, Colorado, post meridiem, percussit, communitates trans El Paso et Douglas comitatus breviter moventes, nullas immediatas relationes damni causantes.
Haec fabula solveret. Plura sequi.
Magnitudo 3…",2025-10-24 04:56:15+00:00
a2e3d9f0d2b827bee055ef9857f9b61e,2025-10-19T14:00:00Z,'earthquake',www.livescience.com,en,0.9,Scientists discover new way to predict next Mount Etna eruption,Researchers analyzed changes over time in the ratio of small earthquakes to bigger ones beneath Mount Etna and found a strong correlation with the volcano's activity over the past 20 years.,https://www.livescience.com/planet-earth/volcanos/scientists-discover-new-way-to-predict-next-mount-etna-eruption,https://cdn.mos.cms.futurecdn.net/XJfB9wiJeCXcqZKQZ47RhC-1024-80.jpg,,"A newly discovered way to monitor magma movements beneath Mount Etna could help scientists forecast when it might erupt.
Mount Etna, located on the Italian island of Sicily, is Europe's largest acti… [+4859 chars]",,"Wissenschaftler entdecken einen neuen Weg, den nächsten Ausbruch des Ätna vorherzusagen. Forscher analysierten zeitliche Veränderungen im Verhältnis von kleinen zu größeren Erdbeben unter dem Ätna und fanden einen starken Zusammenhang mit der Aktivität des Vulkans in den letzten 20 Jahren.",Scientists discover new way to predict next Mount Etna eruption. Researchers analyzed changes over time in the ratio of small earthquakes to bigger ones beneath Mount Etna and found a strong correlation with the volcano's activity over the past 20 years.,Docti viam novam inveniunt ad eruptionem Aetnae montis proximo praedicendi. Investigatores mutationes super tempus explicaverunt in ratione parvarum motuum ad maiora sub monte Etna inventa et validam cum volcano actione per XX annos correlationem invenerunt.,2025-10-24 04:56:15+00:00
963cd9d3229fcb6b72433bf54a9cd929,2025-10-20T19:00:00Z,'earthquake',newatlas.com,en,0.9,Tenant-built bamboo housing resists a 7.7-magnitude earthquake,"In the heart of Mandalay, Burma, a small cluster of bamboo houses has become a symbol of resilience. When a 7.7-magnitude earthquake struck central Myanmar earlier this year, the ground around them split and buildings nearby collapsed. Yet 26 of these homes, …",https://newatlas.com/architecture/housing-now-blue-temple-earthquake-houses/,https://assets.newatlas.com/dims4/default/1cc27e4/2147483647/strip/true/crop/1000x525+0+71/resize/1200x630!/quality/90/?url=https%3A%2F%2Fnewatlas-brightspot.s3.amazonaws.com%2F15%2F3d%2F68bfb491411b8123a5da0b1f252f%2F110095-preview-low-7035-2-110095-sc-v2com.jpg&na.image_optimisation=0,,"In the heart of Mandalay, Burma, a small cluster of bamboo houses has become a symbol of resilience. When a 7.7-magnitude earthquake struck central Myanmar earlier this year, the ground around them s… [+2068 chars]",,"Von Mietern gebautes Bambushaus hält einem Erdbeben der Stärke 7,7 stand. Im Herzen von Mandalay, Burma, ist eine kleine Ansammlung von Bambushäusern zum Symbol der Widerstandsfähigkeit geworden. Als Anfang des Jahres ein Erdbeben der Stärke 7,7 Zentral-Myanmar erschütterte, brach der Boden um sie herum auf und Gebäude in der Nähe stürzten ein. Doch 26 dieser Häuser, …","Tenant-built bamboo housing resists a 7.7-magnitude earthquake. In the heart of Mandalay, Burma, a small cluster of bamboo houses has become a symbol of resilience. When a 7.7-magnitude earthquake struck central Myanmar earlier this year, the ground around them split and buildings nearby collapsed. Yet 26 of these homes, …","Tenens Bamboo habitationi constructa 7.7-magnitudo terrae motus resistit. In corde Mandalay, Burma, parvus botrus bamboo domibus symbolum facta est mollitiae. Cum 7.7-magnitudo terrae motus centralis Myanmar hoc anno anterius percussit, terra circa eas scissuras et aedificia prope concidit. Tamen 26 harum domorum, …",2025-10-24 04:56:15+00:00
95a6b6a768a4cbd1914d30e0c3cb0855,2025-10-23T00:00:00Z,'earthquake',www.nationalgeographic.com,en,0.9,How ‘the big one’ near Seattle could trigger an earthquake in San Francisco,Are two of the deadliest earthquake zones in North America linked? It's possible—but controversial.,https://www.nationalgeographic.com/science/article/cascadia-trigger-san-andreas-earthquake,https://i.natgeofe.com/n/075fc36f-1824-4efd-a90e-6a983820c664/C0296275-Global_tectonics_eastern_Pacific_Plate_16x9.jpg?w=1200,,"The triggering idea is too far a reach at this point, he concludes, although theres a good chance the two fault systems were synchronized at some point in geologic history, perhaps by chance. (Like w… [+1150 chars]",,Wie „das Große“ in der Nähe von Seattle ein Erdbeben in San Francisco auslösen könnte. Sind zwei der tödlichsten Erdbebengebiete in Nordamerika miteinander verbunden? Es ist möglich – aber umstritten.,How ‘the big one’ near Seattle could trigger an earthquake in San Francisco. Are two of the deadliest earthquake zones in North America linked? It's possible—but controversial.,"Quomodo dixit magnus prope Seattle terrae motus in San Francisco trigger. Suntne duo zonae terrae motus gravissimae in America Septentrionali coniuncta? Possibile est, sed controversiae.",2025-10-24 04:56:15+00:00
b199dade30960dcfd9d72b319334ddd2,2025-10-24T17:18:49Z,'earthquake magnitude',www.cbc.ca,en,0.9,"Magnitude 3.5 quake in Sudbury, Ont., caused by mining activities, says Earthquakes Canada",Earthquakes Canada has confirmed that a magnitude 3.5 earthquake felt widely across Greater Sudbury Friday morning was mining induced.,https://www.cbc.ca/news/canada/sudbury/earthquake-sudbury-mining-induced-9.6952216,"https://i.cbc.ca/ais/25389857-1bc3-432b-bcd5-6be29037d032,1761325673629/full/max/0/default.jpg?im=Crop%2Crect%3D%280%2C48%2C1345%2C756%29%3BResize%3D620",,"Earthquakes Canada has confirmed that a magnitude 3.5 earthquake felt widely across Greater Sudbury on Friday morning was induced by mining activity in the area.
The earthquake happened at 11:20 a.m… [+933 chars]",,"Erdbeben der Stärke 3,5 in Sudbury, Ontario, verursacht durch Bergbauaktivitäten, sagt Earthquakes Canada. Earthquakes Canada hat bestätigt, dass ein Erdbeben der Stärke 3,5, das am Freitagmorgen im Großraum Sudbury weit verbreitet war, durch Bergbau verursacht wurde.","Magnitude 3.5 quake in Sudbury, Ont., caused by mining activities, says Earthquakes Canada. Earthquakes Canada has confirmed that a magnitude 3.5 earthquake felt widely across Greater Sudbury Friday morning was mining induced.","Magnitudo 3.5 in Sudbury, Ont., per fodienda opera causata, dicit Terrae motus Canadae. Motus terrae Canada confirmavit magnitudinem 3.5 terrae motus late per Maiorem Sudbury mane Veneris fodienda inductum esse.",2025-10-24 04:56:15+00:00
76402658e50ab89430ca52bba23fda10,2025-10-25T12:42:09Z,'earthquake magnitude',indianexpress.com,en,0.9,China reports magnitude 5.5 earthquake in province near North Korea,"The earthquake struck the Chinese city of Hunchun at 7:45 p.m. local time (1145 GMT), with the epicentre at a depth of 560 kilometres (348 miles).",https://indianexpress.com/article/world/china-reports-magnitude-5-5-earthquake-in-province-near-north-korea-10326647/,https://images.indianexpress.com/2025/10/US-1-46.jpg,,"China on Saturday reported a magnitude 5.5 earthquake in Jilin, a province that shares a border with North Korea, the official Xinhua news agency reported.
The earthquake struck the Chinese city of … [+124 chars]",,"China meldet ein Erdbeben der Stärke 5,5 in einer Provinz nahe Nordkorea. Das Erdbeben erschütterte um 19:45 Uhr die chinesische Stadt Hunchun. Ortszeit (1145 GMT), mit dem Epizentrum in einer Tiefe von 560 Kilometern (348 Meilen).","China reports magnitude 5.5 earthquake in province near North Korea. The earthquake struck the Chinese city of Hunchun at 7:45 p.m. local time (1145 GMT), with the epicentre at a depth of 560 kilometres (348 miles).","Sinae magnitudinem 5.5 terrae motus in provincia prope Coream Septentrionalem tradit. Terrae motus Sinensem urbem Hunchun at 7:45 a.m. loci temporis (1145 GMT), cum epicenter in altitudinem 560 chiliometrorum (348 milia passuum).",2025-10-24 04:56:15+00:00
8557085679236baabdad74f80b7f0d25,2025-10-25T23:52:12Z,'earthquake',biztoc.com,en,0.9,4.6-magnitude earthquake hits Peru,"A quake with a magnitude of 4.6 struck Peru, the United States Geological Survey (USGS) reported.Available data shows that the incident occurred at 10:09 pm UTC, 87 kilometers south of Pacocha, in the...",https://biztoc.com/x/43e5b41401c77079,https://biztoc.com/cdn/43e5b41401c77079_s.webp,,"A quake with a magnitude of 4.6 struck Peru, the United States Geological Survey (USGS) reported.Available data shows that the incident occurred at 10:09 pm UTC, 87 kilometers south of Pacocha, in th… [+69 chars]",,"Erdbeben der Stärke 4,6 erschüttert Peru. Ein Beben der Stärke 4,6 ereignete sich in Peru, wie der United States Geological Survey (USGS) berichtete. Verfügbare Daten zeigen, dass sich der Vorfall um 22:09 Uhr UTC, 87 Kilometer südlich von Pacocha, im...","4.6-magnitude earthquake hits Peru. A quake with a magnitude of 4.6 struck Peru, the United States Geological Survey (USGS) reported.Available data shows that the incident occurred at 10:09 pm UTC, 87 kilometers south of Pacocha, in the...","4.6-magnitudo terrae motus Peruvia pervenit. Motus cum magnitudine 4.6 Peruviae percussit, Civitates Foederatae Americae Geological Survey (USGS) retulit. Praesto esse notitias ostendit incidentes ante 10:09 post meridiem UTC, 87 chiliometrorum Pacochae meridiem versus, in ...",2025-10-24 04:56:15+00:00
a2245e4cd93d76890be0e5d097eb805c,2025-10-27T13:58:03Z,'earthquake',phys.org,en,0.9,Why earthquakes sometimes still occur in tectonically silent regions,"Earthquakes in the American state of Utah, the Soultz-sous-Forêts region of France or in the Dutch province of Groningen should not be able to occur even if the subsurface has been exploited for decades. This is because the shallow subsurface behaves in such …",https://phys.org/news/2025-10-earthquakes-tectonically-silent-regions.html,https://scx2.b-cdn.net/gfx/news/2025/why-earthquakes-someti.jpg,,"Earthquakes in the American state of Utah, the Soultz-sous-Forêts region of France or in the Dutch province of Groningen should not be able to occur even if the subsurface has been exploited for deca… [+4800 chars]",,"Warum Erdbeben manchmal immer noch in tektonisch stillen Regionen auftreten. Erdbeben im amerikanischen Bundesstaat Utah, in der Region Soultz-sous-Forêts in Frankreich oder in der niederländischen Provinz Groningen dürften selbst bei jahrzehntelanger Ausbeutung des Untergrunds nicht auftreten können. Dies liegt daran, dass sich der flache Untergrund so verhält …","Why earthquakes sometimes still occur in tectonically silent regions. Earthquakes in the American state of Utah, the Soultz-sous-Forêts region of France or in the Dutch province of Groningen should not be able to occur even if the subsurface has been exploited for decades. This is because the shallow subsurface behaves in such …","Quare terrae motus interdum adhuc in regionibus tacitis tectonice occurrunt. Motus terrae in statu Americano Utae, in regione Soultz-sous-Forêts Galliae vel in provincia Batavica Groningae evenire non possunt, etsi subsurfacies decenniis abutitur. Hoc est, quia vadum subsurface in tali se gerit.",2025-10-24 04:56:15+00:00
9a49b9320814943431de69c3a18e3557,2025-10-27T16:50:04Z,'earthquake tectonic',phys.org,en,0.9,"Two earthquakes recorded just hours apart in NC mountain community, U.S. Geological Survey reports","Two earthquakes were recorded within hours of each other near Marion, North Carolina, and witnesses report they felt shaking miles away, according to the U.S. Geological Survey.",https://phys.org/news/2025-10-earthquakes-hours-nc-mountain-community.html,https://scx2.b-cdn.net/gfx/news/hires/2020/seismicwaves.jpg,,"Two earthquakes were recorded within hours of each other near Marion, North Carolina, and witnesses report they felt shaking miles away, according to the U.S. Geological Survey.
The quakes registere… [+1819 chars]",,"Laut U.S. Geological Survey wurden in der Berggemeinde North Carolina zwei Erdbeben im Abstand von nur wenigen Stunden registriert. Nach Angaben des U.S. Geological Survey wurden zwei Erdbeben innerhalb weniger Stunden in der Nähe von Marion, North Carolina, registriert, und Zeugen berichten, dass sie kilometerweit entfernt zu zittern schienen.","Two earthquakes recorded just hours apart in NC mountain community, U.S. Geological Survey reports. Two earthquakes were recorded within hours of each other near Marion, North Carolina, and witnesses report they felt shaking miles away, according to the U.S. Geological Survey.","Duae terrae motus mox horae distantes in NC montis communitatis memoriae Geological Survey US tradit. Duo terrae motus intra horas uniuscuiusque prope Marion, Carolinae Septentrionalis commemorati sunt, et testes referre se sensisse milia passuum concussa, secundum Americae Geological Survey.",2025-10-24 04:56:15+00:00
16d50f02e8a8d9a31e8127007349e1a8,2025-10-27T23:57:31Z,'earthquake',abcnews.go.com,en,0.9,"Magnitude 6.1 earthquake hits western Turkey, causing buildings to collapse","A strong earthquake has shaken western Turkey, causing three buildings to collapse",https://abcnews.go.com/International/wireStory/magnitude-61-earthquake-hits-western-turkey-causing-buildings-126913322,https://s.abcnews.com/images/US/abc_news_default_2000x2000_update_16x9_992.jpg,,"ANKARA, Turkey -- A strong earthquake shook western Turkey on Monday, causing at least three buildings that were damaged in a previous tremor to collapse, officials said. There were no immediate repo… [+1697 chars]",,"Ein Erdbeben der Stärke 6,1 erschüttert den Westen der Türkei und lässt Gebäude einstürzen. Ein starkes Erdbeben hat den Westen der Türkei erschüttert und drei Gebäude zum Einsturz gebracht","Magnitude 6.1 earthquake hits western Turkey, causing buildings to collapse. A strong earthquake has shaken western Turkey, causing three buildings to collapse","Magnitudo 6.1 terrae motus Turciae occidentales pervenit, aedificia construxit faciendo. Terrae motus validus Turciam occidentalem concussit, quod tria aedificia construxit",2025-10-24 04:56:15+00:00
f25c9cc49f89bfcb85d4150a3954286f,2025-10-30T00:00:00Z,'earthquake tectonic',www.nature.com,en,0.9,Machine learning predicts meter-scale laboratory earthquakes,"In this study, machine learning accurately predicts meter-scale laboratory quakes from tiny foreshocks, bridging the scale gap between laboratory and natural earthquakes and offering insights into short-term earthquake forecasting.",https://www.nature.com/articles/s41467-025-64542-4,https://media.springernature.com/m685/springer-static/image/art%3A10.1038%2Fs41467-025-64542-4/MediaObjects/41467_2025_64542_Fig1_HTML.png,,"Experimental settings
We briefly summarize the laboratory experiment settings used to measure acoustic emissions and mechanical data31. Acoustic emissions were recorded using 64 shear-mode piezoelec… [+23555 chars]",,"Maschinelles Lernen sagt Laborbeben im Meterbereich voraus. In dieser Studie sagt maschinelles Lernen präzise Laborbeben im Meterbereich aus winzigen Vorbeben voraus, überbrückt die Skalenlücke zwischen Labor- und Naturbeben und bietet Einblicke in die kurzfristige Erdbebenvorhersage.","Machine learning predicts meter-scale laboratory earthquakes. In this study, machine learning accurately predicts meter-scale laboratory quakes from tiny foreshocks, bridging the scale gap between laboratory and natural earthquakes and offering insights into short-term earthquake forecasting.","Apparatus eruditionis terrae motus officinam metri scalam praedicat. In hoc studio, apparatus eruditionis accurate praedicat laboratorium metri metri ex minimis foraminibus commotum, traiiciens scalam interstitium inter laboratorium et terrae motus naturales et praebens perceptiones in breve tempus terrae motus praevidens.",2025-10-24 04:56:15+00:00
e15b479f22fc40c337b094d4873f28ab,2025-10-31T14:23:01Z,'earthquake',www.forbes.com,en,0.9,Cascadia Megaquake Could Also Set Off A Major Earthquake Along The San Andreas Fault,Sediment cores recovered from the Pacific seafloor suggest that megathrust earthquakes along the Cascadia subduction zone may also trigger major seismic events on the San Andreas Fault.,https://www.forbes.com/sites/davidbressan/2025/10/31/cascadia-megaquake-could-also-set-off-a-major-earthquake-along-the-san-andreas-fault/,https://imageio.forbes.com/specials-images/imageserve/605c772ded5676659c2b73e9/0x0.jpg?format=jpg&height=900&width=1600&fit=bounds,,"The Carrizo Plain in eastern San Luis Obispo County contains the most strikingly graphic portion of the San Andreas Fault.
getty
The Pacific coast of the United States sits at the boundary of sever… [+3615 chars]",,"Das Megabeben von Cascadia könnte auch ein schweres Erdbeben entlang der San-Andreas-Verwerfung auslösen. Vom pazifischen Meeresboden geborgene Sedimentkerne deuten darauf hin, dass Megathrust-Erdbeben entlang der Cascadia-Subduktionszone auch große seismische Ereignisse auf der San-Andreas-Verwerfung auslösen könnten.",Cascadia Megaquake Could Also Set Off A Major Earthquake Along The San Andreas Fault. Sediment cores recovered from the Pacific seafloor suggest that megathrust earthquakes along the Cascadia subduction zone may also trigger major seismic events on the San Andreas Fault.,Cascadia Megaquake Posset etiam ponere maiorem terrae motus Secundum San Andreas Grand. Cores faecis e mari Pacifico receptae suadeant megathrustam terrae motus per Zonam subductionem Cascadia posse etiam felices eventus maiores seismicos in San Andreas Fault.,2025-10-24 04:56:15+00:00
d2d8d29231f8704ba4d07c2b1d58caa6,2025-10-09T00:00:00Z,'earthquake',www.jw.org,en,1.0,NEWS RELEASES | Destructive Earthquake Strikes the Philippines,,https://www.jw.org/en/news/region/philippines/Destructive-Earthquake-Strikes-the-Philippines/,https://cms-imgp.jw-cdn.org/img/p/702025159/univ/art/702025159_univ_lsr_lg.jpg,,"On September 30, 2025, a 6.9-magnitude earthquake rocked the coastal city of Bogo, located in the northern part of the Philippines Cebu Province. This earthquake came just days after a typhoon had br… [+1168 chars]",,Pressemitteilungen | Verheerendes Erdbeben erschüttert die Philippinen. Nan,NEWS RELEASES | Destructive Earthquake Strikes the Philippines. nan,NEWS RELEASES | Destructive Earthquake Percutit Philippenses. nan,2025-10-24 04:56:15+00:00
3600ae030733eb522a41c8b8c948abb9,2025-10-10T02:30:43Z,'earthquake',www.aljazeera.com,en,1.0,Tsunami threat as magnitude 7.6 earthquake strikes off southern Philippines,Tsunami evacuation warning after quake strikes in waters off Davao Oriental in the country's Mindanao region.,https://www.aljazeera.com/news/2025/10/10/strong-magnitude-7-6-earthquake-strikes-off-southern-philippines,https://www.aljazeera.com/wp-content/uploads/2025/01/breaking-news%402x-1738224674.webp?resize=1200%2C675,http://web.archive.org/web/20251010031216/https://www.aljazeera.com/news/2025/10/10/strong-magnitude-7-6-earthquake-strikes-off-southern-philippines,"An earthquake of magnitude 7.6 has struck offshore in the southern Philippines, the countrys seismology agency said, with a tsunami warning issued and people in nearby coastal areas urged to evacuate… [+629 chars]",,"Tsunami-Gefahr, da ein Erdbeben der Stärke 7,6 den Süden der Philippinen erschüttert. Tsunami-Evakuierungswarnung nach Erdbeben in den Gewässern vor Davao Oriental in der Region Mindanao des Landes.",Tsunami threat as magnitude 7.6 earthquake strikes off southern Philippines. Tsunami evacuation warning after quake strikes in waters off Davao Oriental in the country's Mindanao region.,Tsunami comminatio cum magnitudine 7.6 terrae motus Philippines meridionali excutit. Tsunami monitum evacuationis postquam commotio in aquis ferit Davao Orientales in regione Mindanao patriae.,2025-10-24 04:56:15+00:00
4f882d93e5d4fb3a817a4f70b3699f9d,2025-10-10T02:36:03Z,'earthquake evacuation',economictimes.indiatimes.com,en,1.0,"Earthquake Today: 7.6 magnitude quake hits southern Philippines, authorities issue tsunami warning","Philippines Earthquake Today : A powerful magnitude 7.6 earthquake struck offshore in the southern Philippines, prompting a tsunami warning and evacuation orders for coastal residents. The Phivolcs agency warned of potential damage and aftershocks, with hazar…",https://economictimes.indiatimes.com/news/international/world-news/philippines-earthquake-today-7-6-magnitude-quake-hits-southern-philippines-authorities-issue-tsunami-warning/articleshow/124442571.cms,"https://img.etimg.com/thumb/msid-124442581,width-1200,height-630,imgsize-150960,overlay-economictimes/articleshow.jpg",http://web.archive.org/web/20251011113813/https://economictimes.indiatimes.com/news/international/world-news/philippines-earthquake-today-7-6-magnitude-quake-hits-southern-philippines-authorities-issue-tsunami-warning/articleshow/124442571.cms,"A powerful earthquake measuring 7.6 magnitude hit off the southern coast of the Philippines on Friday morning at 9.34 am local time, prompting authorities to issue a tsunami warning and urge resident… [+1178 chars]",,"Erdbeben heute: Beben der Stärke 7,6 erschüttert den Süden der Philippinen, Behörden geben Tsunami-Warnung heraus. Erdbeben auf den Philippinen heute: Ein starkes Erdbeben der Stärke 7,6 ereignete sich vor der Küste der südlichen Philippinen und löste eine Tsunami-Warnung und Evakuierungsbefehle für die Küstenbewohner aus. Die Phivolcs-Agentur warnte vor möglichen Schäden und Nachbeben mit Gefahren…","Earthquake Today: 7.6 magnitude quake hits southern Philippines, authorities issue tsunami warning. Philippines Earthquake Today : A powerful magnitude 7.6 earthquake struck offshore in the southern Philippines, prompting a tsunami warning and evacuation orders for coastal residents. The Phivolcs agency warned of potential damage and aftershocks, with hazar…","Terraemotus Hodie: 7.6 magnitudo motus Philippines meridionales pervenit, auctoritates tsunami monentes procedunt. Philippinae Earthquake Hodie: Magnitudo potens 7.6 terrae motus littus pulsavit in Philippinis australibus, suggerens tsunami admonitionem et evacuationem ordines pro habitantibus maritimis. Procuratio Phivolcs monuit de damnis potentialibus et aftershocks, cum hazar...",2025-10-24 04:56:15+00:00
c34084d1dde2a2695dccc3402b6c7dc5,2025-10-10T04:22:11Z,'earthquake',en.antaranews.com,en,1.0,BMKG urges calm after 7.6-Magnitude quake near North Sulawesi,"The Meteorology, Climatology, and Geophysics Agency (BMKG) has urged residents to remain calm after a 7.6-magnitude earthquake struck northwest of Karatung ...",https://en.antaranews.com/news/385281/bmkg-urges-calm-after-76-magnitude-quake-near-north-sulawesi,https://cdn.antaranews.com/cache/1200x800/2025/10/10/IMG-20251010-WA0009_copy_1600x1185.jpg,,"Manado (ANTARA) - The Meteorology, Climatology, and Geophysics Agency (BMKG) has urged residents to remain calm after a 7.6-magnitude earthquake struck northwest of Karatung Island, Nanusa sub-distri… [+1560 chars]",,"BMKG mahnt zur Ruhe nach Erdbeben der Stärke 7,6 in der Nähe von Nord-Sulawesi. Die Agentur für Meteorologie, Klimatologie und Geophysik (BMKG) hat die Bewohner aufgefordert, Ruhe zu bewahren, nachdem nordwestlich von Karatung ein Erdbeben der Stärke 7,6 erschüttert wurde ...","BMKG urges calm after 7.6-Magnitude quake near North Sulawesi. The Meteorology, Climatology, and Geophysics Agency (BMKG) has urged residents to remain calm after a 7.6-magnitude earthquake struck northwest of Karatung ...","BMKG tranquillitas post 7.6-magnitudo prope Sulawesiam septentrionalem mota hortatur. Meteorologia, Climatologia, et Agency Geophysica (BMKG) incolas ad tranquillitatem manere hortatus est post 7.6-magnitudo terrae motus chorum Karatung percussit.",2025-10-24 04:56:15+00:00
