index,published,keyword,domain,language,valid,title,description,url,image,archive,content,quote,de,en,la,added
986a470b261fbf7714773704f9e92d10,2026-06-02T21:10:51Z,'earthquake',freerepublic.com,en,0.9,A 6.2 earthquake rattled southern Italy and was felt hundreds of kilometres away,"For thousands of people across southern Italy, the first sign that something unusual had happened was not a news alert or a warning from authorities. It was the sound. Shortly after midnight on 2 June, residents in several regions reported hearing a loud rumb…",https://freerepublic.com/focus/f-chat/4382093/posts,,,"Skip to comments.
A 6.2 earthquake rattled southern Italy and was felt hundreds of kilometres awayEuroweekly News ^
 | 02 Jun 2026
 | Farah Mokrani
Posted on 06/02/2026 2:10:51 PM PDT by nickcarr… [+5657 chars]",,"Ein Erdbeben der Stärke 6,2 erschütterte Süditalien und war Hunderte Kilometer entfernt zu spüren. Für Tausende Menschen in ganz Süditalien war das erste Anzeichen dafür, dass etwas Ungewöhnliches passiert war, weder eine Nachrichtenmeldung noch eine Warnung der Behörden. Es war das Geräusch. Kurz nach Mitternacht am 2. Juni meldeten Anwohner in mehreren Regionen, dass sie ein lautes Grollen hörten …","A 6.2 earthquake rattled southern Italy and was felt hundreds of kilometres away. For thousands of people across southern Italy, the first sign that something unusual had happened was not a news alert or a warning from authorities. It was the sound. Shortly after midnight on 2 June, residents in several regions reported hearing a loud rumb…","A 6.2 Terraemotus in Italia meridionali crepuit et sensit centum chiliometrorum abesse. Ad mille hominum per Italiam meridionalem, primum signum insolitum accidisse non fuit nuntium intentum vel monitum ab auctoribus. Integer erat. Paulo post mediam noctem die 2 mensis Iunii habitant in pluribus regionibus auditum sonum elatum.",2026-06-04 16:35:19+00:00
9a1bc7b067de925d798b7d0cce3ea196,2026-06-03T13:15:51Z,'earthquake',www.dailymail.com,en,0.9,Earthquake warnings flash across two US states as multiple quakes rock West Coast,"Thousands along the West Coast were rattled by multiple strong earthquakes, triggering alerts from emergency officials.",https://www.dailymail.com/sciencetech/article-15870629/earthquake-warnings-california-oregon.html,https://i.dailymail.com/1s/2026/06/03/13/109081951-0-image-m-12_1780491151547.jpg,,"A pair of large earthquakes right off the West Coast has sent shockwaves across two states Wednesday morning.
The US Geological Survey sent out alerts after detecting a magnitude 5.7 earthquake in t… [+1371 chars]",,"In zwei US-Bundesstaaten blitzen Erdbebenwarnungen auf, während mehrere Erdbeben die Westküste erschüttern. Tausende Menschen entlang der Westküste wurden von mehreren starken Erdbeben erschüttert, die Alarme der Notfallkräfte auslösten.","Earthquake warnings flash across two US states as multiple quakes rock West Coast. Thousands along the West Coast were rattled by multiple strong earthquakes, triggering alerts from emergency officials.","Monitiones terrae motus per duas Civitates US micant sicut plures motus petrae occidentis Coast. Milia in Occidente oram terrae motibus validis crepuerunt, summisque a magistratibus subitis excitato.",2026-06-04 16:35:19+00:00
fa58a53f3b62c608f3e079c267552fc1,2026-06-04T21:31:25Z,'earthquake',www.dailymail.com,en,0.9,Las Vegas struck by house-shaking earthquake as thousands are left rattled,Las Vegas has been struck by an earthquake felt by thousands throughout the major tourist destination.,https://www.dailymail.com/sciencetech/article-15875389/las-vegas-earthquake-nevada.html,https://i.dailymail.com/1s/2026/06/04/22/109135821-0-image-m-10_1780607755611.jpg,,"An earthquake has struck the city of Las Vegas, rattling hundreds of thousands of residents and vacationers in the Nevada desert.
The magnitude 3.8 quake was detected at 4.47pm ET less than 15 miles… [+796 chars]",,"Las Vegas wurde von einem erschütternden Erdbeben heimgesucht, Tausende sind erschüttert. Las Vegas wurde von einem Erdbeben heimgesucht, das Tausende im gesamten Haupttouristenziel spürten.",Las Vegas struck by house-shaking earthquake as thousands are left rattled. Las Vegas has been struck by an earthquake felt by thousands throughout the major tourist destination.,Las Vegas terrae motus concussus concussus ac mille crepitantibus relinquuntur. Las Vegas motus terrae motu concussus est per milia per totum urbis finem maiorem.,2026-06-05 23:50:04+00:00
8ff358c2ef4fc38347787e75dcf7ab16,2026-06-03T13:33:25Z,'earthquake magnitude',www.dailymail.com,en,0.9,The 'Big One' could strike in New Zealand: Scientists discover an active fault line running through Auckland - and warn it could spark a 6.8 magnitude earthquake at any time,The 'Big One' earthquake is usually associated with California. But scientists have warned that it could strike in New Zealand - after finding an active fault line running through the country.,https://www.dailymail.com/sciencetech/article-15870405/Big-One-New-Zealand-6-8-magnitude-earthquake.html,https://i.dailymail.com/1s/2026/06/03/14/109082689-0-image-a-16_1780493232640.jpg,,"The 'Big One' earthquake is usually associated with California. 
But scientists have warned that it could strike in New Zealand after finding an active fault line running through the country. 
Name… [+3489 chars]",,"Der „Große“ könnte in Neuseeland zuschlagen: Wissenschaftler entdecken eine aktive Verwerfungslinie, die durch Auckland verläuft – und warnen, dass sie jederzeit ein Erdbeben der Stärke 6,8 auslösen könnte. Das „Big One“-Erdbeben wird normalerweise mit Kalifornien in Verbindung gebracht. Wissenschaftler haben jedoch gewarnt, dass es in Neuseeland zuschlagen könnte – nachdem sie eine aktive Verwerfungslinie entdeckt hatten, die durch das Land verläuft.",The 'Big One' could strike in New Zealand: Scientists discover an active fault line running through Auckland - and warn it could spark a 6.8 magnitude earthquake at any time. The 'Big One' earthquake is usually associated with California. But scientists have warned that it could strike in New Zealand - after finding an active fault line running through the country.,"""Big One"" in Nova Zelandia percutere potuit: Scientistae detegunt culpam activam per Auckland lineam currentem - et monent scintillam a 6.8 magnitudine motus aliquando posse. Terrae motus magnus in California fere coniungitur. Sed docti monuerunt eum in Nova Zelandia percutere posse - postquam culpam activam per regionem currit rectam invenire.",2026-06-06 07:36:58+00:00
b33ba14f111185e6e316fc7fd11b2794,2026-06-04T22:00:12Z,'earthquake magnitude',www.fox5vegas.com,en,0.9,4.1 mag quake shakes Vegas...,Preliminary 4.1 earthquake reported 14 miles west of Las Vegas,https://www.fox5vegas.com/2026/06/04/preliminary-407-earthquake-reported-14-miles-west-las-vegas/,https://gray-kvvu-prod.gtv-cdn.com/resizer/v2/WCF3DDBOQFCXLI5SZD5K4X5ZPA.png?auth=2052ab786bf437300b1721a9922c896f001b30d166d6410ad6bf79d9d98835ed&width=1200&height=600&smart=true,http://web.archive.org/web/20260604215459/https://www.fox5vegas.com/2026/06/04/preliminary-407-earthquake-reported-14-miles-west-las-vegas/,"LAS VEGAS (FOX5) A preliminary magnitude 4.07 earthquake struck about 14 miles west of Las Vegas Thursday afternoon, according to early seismic data.
The quake occurred at 1:47 p.m. on Thursday. 
T… [+284 chars]",,"Beben der Stärke 4,1 erschüttert Vegas.... Vorläufiges Erdbeben der Stärke 4,1 wurde 14 Meilen westlich von Las Vegas gemeldet",4.1 mag quake shakes Vegas.... Preliminary 4.1 earthquake reported 14 miles west of Las Vegas,4.1 mag commotio quatit Vegas.... Praevia 4.1 terrae motus nuntiavit 14 milia passuum occidentem Las Vegas,2026-06-06 07:36:58+00:00
acbd33852aab6c2accde0158188d044e,2026-06-03T05:32:43Z,'earthquake',www.sciencedaily.com,en,0.9,Scientists confirm a deep earthquake that shouldn't exist,"Scientists have confirmed that a mysterious Utah earthquake first detected in 1979 really did occur nearly 90 kilometers underground—far deeper than anyone thought earthquakes could happen beneath a continent. By reanalyzing decades of seismic data, researche…",https://www.sciencedaily.com/releases/2026/06/260602021636.htm,https://www.sciencedaily.com/images/1920/deep-earthquake-magma-fissures.webp,http://web.archive.org/web/20260603230500/https://www.sciencedaily.com/releases/2026/06/260602021636.htm,"Nearly half a century ago, a small earthquake beneath northern Utah left seismologists puzzled. The event seemed to originate far deeper than earthquakes were thought capable of occurring beneath a c… [+6410 chars]",,"Wissenschaftler bestätigen ein schweres Erdbeben, das es nicht geben sollte. Wissenschaftler haben bestätigt, dass ein mysteriöses Erdbeben in Utah, das erstmals 1979 entdeckt wurde, tatsächlich fast 90 Kilometer unter der Erde stattfand – viel tiefer, als irgendjemand gedacht hätte, dass Erdbeben unter einem Kontinent passieren könnten. Durch die erneute Analyse jahrzehntelanger seismischer Daten konnten Forscher…","Scientists confirm a deep earthquake that shouldn't exist. Scientists have confirmed that a mysterious Utah earthquake first detected in 1979 really did occur nearly 90 kilometers underground—far deeper than anyone thought earthquakes could happen beneath a continent. By reanalyzing decades of seismic data, researche…","Physici confirmant terrae motum altum esse non debet. Scientici confirmaverunt terrae motum arcanum Utah primo anno 1979 detectum vere accidisse paene 90 chiliometrorum sub terra — multo altius quam quisquam putabat terrae motus sub continenti accidere potuisse. Decennia seismicarum notitiarum reanalyzing, investigationem…",2026-06-06 15:01:46+00:00
ab6dc71d1a17dd08a8371329ea46e825,2026-06-03T16:01:42Z,'earthquake magnitude',www.foxweather.com,en,0.9,Magnitude 4.6 earthquake strikes off coast of Hawaii’s Big Island,Shaking was felt across the Big Island and parts of Maui.,https://www.foxweather.com/weather-news/earthquake-shakes-hawaii-big-island-volcano,https://nypost.com/wp-content/uploads/sites/2/2026/06/waves-pacific-ocean-break-along-129612950_01fb82.jpg?quality=75&strip=all&w=1200,http://web.archive.org/web/20260604045921/https://www.foxweather.com/weather-news/earthquake-shakes-hawaii-big-island-volcano,"KAHALUU-KEAUHOU, Hawaii  A magnitude-4.6 earthquake shook the Kona Coast on Hawaii’s Big Island at 5:58 p.m. local time on Monday, according to the USGS.
The epicenter was a little more than 3.5 mil… [+831 chars]",,"Erdbeben der Stärke 4,6 ereignet sich vor der Küste von Hawaiis Big Island. Auf Big Island und Teilen von Maui waren Erschütterungen zu spüren.",Magnitude 4.6 earthquake strikes off coast of Hawaii’s Big Island. Shaking was felt across the Big Island and parts of Maui.,Magnitude 4.6 terrae motus maritimam Islandiae Big Hawaii excutit. Concussio sentitur trans Magnam Islandiam et partes Maui.,2026-06-06 15:01:46+00:00
d479e2250ea161d475cec092351bf8ed,2026-06-04T12:17:22Z,'earthquake damage',www.usatoday.com,en,0.9,Back-to-back 5.0-plus earthquakes shake California. See where,Earthquakes near Mendocino Triple Junction shake waters off Northern California with no tsunami or major damage.,https://www.usatoday.com/story/news/weather/2026/06/04/earthquake-today-california-oregon-explainer/90400624007/,https://s.yimg.com/lo/mysterio/api/0366412b559235455e0d38033147c6bf6bb5095a70bdebc85e6254960c7c8026/lightyear_networkapi/resizefill_w1200;quality_80;format_webp/https:%2F%2Fmedia.zenfs.com%2Fen%2Fusa_today_news_641%2Fd1217d18c10c772d7bcf8e608e08029a,http://web.archive.org/web/20260605071803/https://www.usatoday.com/story/news/weather/2026/06/04/earthquake-today-california-oregon-explainer/90400624007/,"A series of moderate earthquakes rattled the waters off the West Coast early Thursday, June 4, near the Mendocino Triple Junction, where three tectonic plates meet off Northern California's coast, on… [+4046 chars]",,"Aufeinanderfolgende Erdbeben der Stärke 5,0 erschüttern Kalifornien. Sehen Sie, wo. Erdbeben in der Nähe von Mendocino Triple Junction erschütterten die Gewässer vor Nordkalifornien, ohne dass es zu einem Tsunami oder größeren Schäden kam.",Back-to-back 5.0-plus earthquakes shake California. See where. Earthquakes near Mendocino Triple Junction shake waters off Northern California with no tsunami or major damage.,Retro-ad-retro 5.0-plus terrae motus Californiam concutiunt. Vide ubi. Motus terrae prope Mendocino Triplex adiunctionis aquas agitant in California septentrionali cum nullo tsunami vel maiore damno.,2026-06-06 15:01:46+00:00
c7466c4fa7d673cc28648e4e14c11973,2026-06-05T14:38:40Z,'earthquake',insidethemagic.net,en,0.9,Earthquake Strikes Universal Location,"An earthquake rattled a Universal location on May 4, 2026, leading social media to blow up over who felt it. Universal Location Suffers Earthquake For millions of visitors, Las Vegas is a place where reality feels suspended. The city is built on spectacle, ex…",https://insidethemagic.net/2026/06/las-vegas-universal-horror-unleashed-earthquake-emd1/,https://insidethemagic.net/wp-content/uploads/2026/05/universal-orlando-globe-1.jpg,,"An earthquake rattled a Universal location on May 4, 2026, leading social media to blow up over who felt it.
Credit: Universal
Universal Location Suffers Earthquake
For millions of visitors, Las V… [+6968 chars]",,"Erdbeben erschüttert universellen Standort. Am 4. Mai 2026 erschütterte ein Erdbeben einen Universal-Standort und sorgte in den sozialen Medien für Aufregung darüber, wer davon betroffen war. Universeller Standort erleidet Erdbeben Für Millionen von Besuchern ist Las Vegas ein Ort, an dem die Realität außer Kraft gesetzt zu sein scheint. Die Stadt ist auf Spektakel gebaut, ex…","Earthquake Strikes Universal Location. An earthquake rattled a Universal location on May 4, 2026, leading social media to blow up over who felt it. Universal Location Suffers Earthquake For millions of visitors, Las Vegas is a place where reality feels suspended. The city is built on spectacle, ex…","Terrae motus Stridet Location universalis. Motus motus obstrepebat locum Universalem die 4 mensis Maii anno 2026 ducens instrumentorum socialium qui illum sentirent conflare. Universalis Location Terrae motus patitur Pro millions hospitum, Las Vegas locus est ubi res suspensa sentit. Spectaculo aedificata urbs est, ex…",2026-06-07 15:14:39+00:00
65cee9a2f7c89b17c2b9e8647c045563,2026-06-05T17:14:08Z,'earthquake damage',timesofindia.indiatimes.com,en,0.9,5.0 magnitude earthquake jolts Chamba and other Himachal Pradesh districts,"A moderate 5.0 magnitude earthquake jolted Chamba district in Himachal Pradesh on Friday night at 10:04 pm. Tremors were felt across Chamba and nearby areas, including the state capital Shimla. No casualties or significant damage have been reported following …",https://timesofindia.indiatimes.com/city/shimla/5-0-magnitude-earthquake-jolts-chamba-and-other-himachal-pradesh-districts/articleshow/131537284.cms,"https://static.toiimg.com/thumb/msid-131537372,width-1280,height-720,resizemode-6,overlay-toi_sw,pt-32,y_pad-600/photo.jpg",,"Copyright © 2026 Bennett, Coleman &amp; Co. Ltd. All rights reserved. For reprint rights: Times Syndication Service",,"Erdbeben der Stärke 5,0 erschüttert Chamba und andere Bezirke von Himachal Pradesh. Ein mittelschweres Erdbeben der Stärke 5,0 erschütterte am Freitagabend um 22:04 Uhr den Bezirk Chamba in Himachal Pradesh. In Chamba und den umliegenden Gebieten, einschließlich der Landeshauptstadt Shimla, waren Erschütterungen zu spüren. Es wurden keine Verletzten oder nennenswerten Schäden gemeldet …","5.0 magnitude earthquake jolts Chamba and other Himachal Pradesh districts. A moderate 5.0 magnitude earthquake jolted Chamba district in Himachal Pradesh on Friday night at 10:04 pm. Tremors were felt across Chamba and nearby areas, including the state capital Shimla. No casualties or significant damage have been reported following …","5.0 Magnitudo terrae motus jolts Chamba et aliae regiones Himachal Pradesh. Moderatus 5.0 magnitudinis terrae motus commotus est Chamba districtus in Himachal Pradesh die Veneris noctis 10:04 pm. Tremors trans Chamba et locis vicinis sentiebantur, cum status capitalis Shimla. Nullae caedes vel damna significantia quae sequuntur nuntiata sunt.",2026-06-07 15:14:39+00:00
c1e07a24f096401ad6e1bf26afef1227,2026-06-05T17:35:17Z,'earthquake',economictimes.indiatimes.com,en,0.9,Himachal Pradesh Earthquake: 5.0 magnitude quake jolts Chamba and nearby districts,"Himachal Pradesh Earthquake: A 5.0-magnitude earthquake struck Chamba district in Himachal Pradesh on Friday night. The tremor occurred at 10:04 pm and was felt across Chamba and nearby areas. Mild tremors were also reported in the state capital, Shimla. No c…",https://economictimes.indiatimes.com/news/new-updates/earthquake-in-himachal-pradesh-5-0-magnitude-latest-news-photos-quake-jolts-chamba-and-nearby-districts/articleshow/131537805.cms,"https://img.etimg.com/thumb/msid-131538288,width-1200,height-630,imgsize-1295745,overlay-economictimes/articleshow.jpg",http://web.archive.org/web/20260606064408/https://economictimes.indiatimes.com/news/new-updates/earthquake-in-himachal-pradesh-5-0-magnitude-latest-news-photos-quake-jolts-chamba-and-nearby-districts/articleshow/131537805.cms,"Alpha Trade
Get daily trade ideas from SEBI-registered research analysts.
Investment Ideas
Grow your wealth with stock ideas &amp; sectoral trends.
Stock Reports Plus
All-in-one stock research w… [+512 chars]",,"Erdbeben in Himachal Pradesh: Beben der Stärke 5,0 erschüttert Chamba und umliegende Bezirke. Erdbeben in Himachal Pradesh: Ein Erdbeben der Stärke 5,0 erschütterte am Freitagabend den Bezirk Chamba in Himachal Pradesh. Das Beben ereignete sich um 22:04 Uhr und war in ganz Chamba und den umliegenden Gebieten zu spüren. Auch aus der Landeshauptstadt Shimla wurden leichte Erschütterungen gemeldet. Kein c…","Himachal Pradesh Earthquake: 5.0 magnitude quake jolts Chamba and nearby districts. Himachal Pradesh Earthquake: A 5.0-magnitude earthquake struck Chamba district in Himachal Pradesh on Friday night. The tremor occurred at 10:04 pm and was felt across Chamba and nearby areas. Mild tremors were also reported in the state capital, Shimla. No c…",Himachal Pradesh Terraemotus: 5.0 magnitudo commota succorum Chamba et vicinarum regionum. Himachal Pradesh Terrae motus: 5.0-magnitudo terrae motus Chamba districtus in Himachal Pradesh die Veneris nocte percussit. Tremor ante 10:04 post meridiem factus est et trans Chamba et locis vicinis sentitur. tremores mites etiam in urbe capitali Shimla relati sunt. Non c…,2026-06-07 15:14:39+00:00
001a38020e83847b32dfd1e489b1e6a1,2026-06-07T17:55:58Z,'earthquake magnitude',economictimes.indiatimes.com,en,0.7,"Earthquake of magnitude 5.6 strikes Bhutan, GFZ says","The ​quake was ⁠at a ​depth of ​10 ‌km (6.21 miles), ​GFZ ​said.",https://economictimes.indiatimes.com/news/international/world-news/earthquake-of-magnitude-5-6-strikes-bhutan-gfz-says/articleshow/131571956.cms,"https://img.etimg.com/thumb/msid-131571956,width-1200,height-630,imgsize-517173,overlay-economictimes/articleshow.jpg",,"Alpha Trade
Get daily trade ideas from SEBI-registered research analysts.
Investment Ideas
Grow your wealth with stock ideas &amp; sectoral trends.
Stock Reports Plus
All-in-one stock research w… [+512 chars]",,"Laut GFZ erschüttert ein Erdbeben der Stärke 5,6 Bhutan. Das Beben ereignete sich laut GFZ in einer Tiefe von 10 km (6,21 Meilen).","Earthquake of magnitude 5.6 strikes Bhutan, GFZ says. The ​quake was ⁠at a ​depth of ​10 ‌km (6.21 miles), ​GFZ ​said.","Terrae motus magnitudinis 5.6 dicit Bhutan, GFZ. Motus ad altitudinem 10‌km (6.21 milium) GFZ dixit.",2026-06-08 23:50:58+00:00
e41f6f61dffa3ced4dd810ba94674187,2026-06-02T00:20:03Z,'earthquake charity',timesofmalta.com,en,0.3,Fireworks factory explosion registers 1.9 magnitude on Richter scale,Fireworks factory explosion registers 1.9 magnitude on Richter scaletimesofmalta.com,https://timesofmalta.com/article/fireworks-factory-explosion-registers-19-magnitude-richter-scale.1129355,https://cdn-attachments.timesofmalta.com/8b70aa6475afe93cd3f86d61aabda096cf2b8d19-1780329563-17f826b5-1200x630.jpg,,"A powerful fireworks factory explosion which rocked Salina on Monday morning registered a magnitude of 1.9 on the Richter scale, according to earthquake monitoring sites. 
Two farmers tilling nearby… [+649 chars]",,"Explosion in Feuerwerksfabrik mit Stärke 1,9 auf der Richterskala. Explosion in Feuerwerksfabrik registriert Stärke 1,9 auf Richterskalatimesofmalta.com",Fireworks factory explosion registers 1.9 magnitude on Richter scale. Fireworks factory explosion registers 1.9 magnitude on Richter scaletimesofmalta.com,Fireworks officinas explosiones registrarum 1.9 magnitudinis in scala Richter. Fireworks officinas explosiones registrae 1.9 magnitudinis in Richter scaletimesofmalta.com,2026-06-09 08:20:30+00:00
b2441a2c0746baf099b022dcb3f1a5e6,2026-06-01T13:22:00Z,'earthquake magnitude',www.newser.com,en,0.9,Kona's Coveted Coffee Crop Is in Trouble,"Water is suddenly the scarcest thing on Hawaii's lush Kona coffee belt. A 6.0-magnitude earthquake that struck the Big Island 10 days ago shattered rainwater catchment tanks that hundreds of Kona farmers depend on for drinking, bathing, and irrigating some of…",https://www.newser.com/story/390174/konas-coveted-coffee-crop-is-in-trouble.html,https://img1-azrcdn.newser.com/image/1688860-12-20260601084546.jpeg,,Water is suddenly the scarcest thing on Hawaii's lush Kona coffee belt. A 6.0-magnitude earthquake that struck the Big Island 10 days ago shattered rainwater catchment tanks that hundreds of Kona far… [+520 chars],,"Konas begehrte Kaffeeernte steckt in Schwierigkeiten. Wasser ist plötzlich das knappste Gut im üppigen Kona-Kaffeegürtel Hawaiis. Ein Erdbeben der Stärke 6,0, das Big Island vor 10 Tagen erschütterte, zerstörte Regenwasserauffangbecken, auf die Hunderte von Kona-Bauern zum Trinken, Baden und zur Bewässerung einiger… angewiesen sind.","Kona's Coveted Coffee Crop Is in Trouble. Water is suddenly the scarcest thing on Hawaii's lush Kona coffee belt. A 6.0-magnitude earthquake that struck the Big Island 10 days ago shattered rainwater catchment tanks that hundreds of Kona farmers depend on for drinking, bathing, and irrigating some of…","Kona scriptor Coffee seges in tribulatione concupivit. Aqua subito quam rarissima est in Hawaii opimae Kona balteus capulus. Magnitudo terrae motus magnus Islandiae percussit A ​​6.0 abhinc diebus X lacus aqua pluvialis concussa quae centenarii Kona agricolae pendent ad bibendum, lavandum, et ad irrigandum nonnullos…",2026-06-09 08:20:30+00:00
5dd4984730cf5739ecc9d6bb869715a2,2026-06-06T10:30:00Z,'earthquake',www.motorbiscuit.com,en,0.7,"F1 2026 Rumor Earthquake: George Russell’s Trap Door, Verstappen’s Escape, and the Piastri Poach","Listen, we all knew the 2026 Formula 1 silly season was going to be a messy affair, but the latest paddock rumors just cranked the insanity dial until it completely snapped off. Forget simple driver swaps; we are looking at…",https://www.motorbiscuit.com/f1-2026-rumor-earthquake-george-russells-trap-door-verstappens-escape-and-the-piastri-poach/,https://s.yimg.com/os/en/motorbiscuit_articles_333/4a87f893ea770b52c134488c9c1dab5f,http://web.archive.org/web/20260607014837/https://www.motorbiscuit.com/f1-2026-rumor-earthquake-george-russells-trap-door-verstappens-escape-and-the-piastri-poach/,"Listen, we all knew the 2026 Formula 1 silly season was going to be a messy affair, but the latest paddock rumors just cranked the insanity dial until it completely snapped off. Forget simple driver … [+2113 chars]",,"F1 2026 Gerüchte-Erdbeben: George Russells Falltür, Verstappens Flucht und die Piastri-Wilderung. Hören Sie, wir alle wussten, dass die verrückte Formel-1-Saison 2026 eine chaotische Angelegenheit werden würde, aber die neuesten Fahrerlager-Gerüchte haben den Wahnsinn nur so stark in Aufruhr versetzt, dass er völlig abbrach. Vergessen Sie einfache Fahrerwechsel; wir schauen uns an…","F1 2026 Rumor Earthquake: George Russell’s Trap Door, Verstappen’s Escape, and the Piastri Poach. Listen, we all knew the 2026 Formula 1 silly season was going to be a messy affair, but the latest paddock rumors just cranked the insanity dial until it completely snapped off. Forget simple driver swaps; we are looking at…","F1 2026 Rumor Earthquake: George Russell's Trap Door, Verstappen's Escape, et Piastri Poach. Audite, nos omnes cognovimus 2026 Formulae I tempus ineptum futurum esse rei nuntius, sed rumores tardus pabuli tantum curuum horologii insaniam, donec penitus abripitur. Simplex agitator swaps obliviscere; spectamus ...",2026-06-09 23:58:09+00:00
