index,published,keyword,domain,language,valid,title,description,url,image,archive,content,quote,de,en,la,added
fd766a5ec501cb920d20f19ede3546f1,2025-10-15T23:48:48Z,'earthquake victims',survivalblog.com,en,0.1,"The Social and Psychological Cost of Preparedness, by A.C.","This is one topic that rarely gets any attention in the preparedness community, and I want to break it down all the way from the “prepper stigma” to the arguments and counterpoints we can make when confronted with the “tinfoil hat” comments by non-preppers in…",https://survivalblog.com/2025/10/17/the-social-and-psychological-cost-of-preparedness-by-ac/,https://survivalblog.com/wp-content/uploads/2016/08/solar-panel-prepper.jpg,,"This is one topic that rarely gets any attention in the preparedness community, and I want to break it down all the way from the prepper stigma to the arguments and counterpoints we can make when con… [+9002 chars]",,"Die sozialen und psychologischen Kosten der Vorbereitung, von A.C.. Dies ist ein Thema, das in der Bereitschaftsgemeinschaft selten Beachtung findet, und ich möchte es vom „Prepper-Stigma“ bis zu den Argumenten und Kontrapunkten aufschlüsseln, die wir vorbringen können, wenn wir mit den „Alufolienhut“-Kommentaren von Nicht-Preppern in… konfrontiert werden.","The Social and Psychological Cost of Preparedness, by A.C.. This is one topic that rarely gets any attention in the preparedness community, and I want to break it down all the way from the “prepper stigma” to the arguments and counterpoints we can make when confronted with the “tinfoil hat” comments by non-preppers in…","Pretium sociale et Psychologicum Praeparationis, ab A.C.. Hic unus locus est qui in praeparatione communitatis raro aliquam attentionem accipit, et eam omnem modum a ""preppri stigmate"" infringere cupimus argumentis et calculis, cum opponi "" petasi petuli"" commentationes a non-preppers in…",2025-10-24 04:56:15+00:00
886ac077f5aac2e68480ad3e102a47ac,2025-10-16T07:04:08Z,'earthquake victims',www.irishtimes.com,en,0.1,"Connolly storms into presidential race lead, Irish Times poll shows","Independent TD is on 38 per cent, almost double the support of Fine Gael’s Heather Humphreys",https://www.irishtimes.com/politics/2025/10/16/poll-shows-connolly-with-huge-lead/,https://www.irishtimes.com/resizer/v2/4GDVE7HNNZCB7DDUXHQPXOJMLI.jpg?smart=true&auth=852600e1a50f0eb333beae72d0b1f53397c85f8d48f3d58fd5b8b8731a06b9d1&width=1200&height=630,,It is just over a week until voters cast their ballots in the presidential election and looking at todays opinion poll one thing is clear: Heather Humphreys has a mountain to climb if she is to deny … [+4301 chars],,"Connolly stürmt ins Rennen um die Präsidentschaftswahl, wie eine Umfrage der Irish Times zeigt. Der unabhängige TD liegt bei 38 Prozent, fast doppelt so viel wie Heather Humphreys von Fine Gael","Connolly storms into presidential race lead, Irish Times poll shows. Independent TD is on 38 per cent, almost double the support of Fine Gael’s Heather Humphreys","Tempestates Connollae in genus praesidentiale ducunt, Tempora hibernica capita devicit. Independentis TD est in 38 centesimis, fere duplex auxilium de Fine Gael's Heather Humphreys.",2025-10-24 04:56:15+00:00
27b56a868e253590cd3c439a3d3981e1,2025-10-16T15:03:03Z,'earthquake salvage',www.kpbs.org,en,0.1,Nearly a million San Diegans registered for Great California Shakeout event,"A total of 980,458 participants are registered in San Diego to stop everything for a minute to ""drop, cover and hold on"" at 10:16 a.m.",https://www.kpbs.org/news/public-safety/2025/10/16/nearly-a-million-san-diegans-registered-for-great-california-shakeout-event,https://cdn.kpbs.org/dims4/default/555e229/2147483647/strip/true/crop/4535x2381+0+253/resize/1200x630!/quality/90/?url=http%3A%2F%2Fkpbs-brightspot.s3.us-west-2.amazonaws.com%2Fimg%2Fphotos%2F2017%2F10%2F19%2FAP_887753274114.jpg,,"Nearly a million San Diego County residents will participate Thursday in this year's Great California ShakeOut, the statewide earthquake preparedness drill, now in its 17th year.
A total of 980,458 … [+2490 chars]",,"Fast eine Million Einwohner von San Diego haben sich für das Great California Shakeout-Event registriert. Insgesamt sind in San Diego 980.458 Teilnehmer registriert, um um 10:16 Uhr alles für eine Minute anzuhalten, um „abzuwerfen, zu decken und festzuhalten“.","Nearly a million San Diegans registered for Great California Shakeout event. A total of 980,458 participants are registered in San Diego to stop everything for a minute to ""drop, cover and hold on"" at 10:16 a.m.","Fere decies centena millia San Diegans descripserunt pro eventu magni California Shakeout. Summa de 980,458 participantium descripserunt in San Diego ut omnia minutatim prohibere ut ""guttare, operire et tenere"" at 10:16 a.m.",2025-10-24 04:56:15+00:00
3da2f040d40705c8838a40c13deac60c,2025-10-16T16:19:00Z,'earthquake victims',www.thestranger.com,en,0.1,"Slog AM: Mariners Lose, Mothers of Sons Killed by Gun Violence Say Harrell Ignored Their Pleas, Pentagon Reporters Turn In Badges","The Stranger's morning news roundup.
 
 by Vivian McCall
 
 
 
 Can He Do That? Bruce Harrell spoke at a fundraiser for the Political Action Committee supporting his campaign, according to an email invitation obtained by The Stranger. The state’s election aut…",https://www.thestranger.com/slog-am/2025/10/16/80285092/slog-am-mariners-lose-mothers-of-sons-killed-by-gun-violence-say-harrell-ignored-their-pleas-pentagon-reporters-turn-in-badges,https://media2.fdncms.com/stranger/imager/u/large/80285095/img_6059.webp,,"Can He Do That? Bruce Harrell spoke at a fundraiser for the Political Action Committee supporting his campaign, according to an email invitation obtained by The Stranger. The states election authorit… [+7568 chars]",,"Slog AM: Marinesoldaten verlieren, Mütter von Söhnen, die durch Waffengewalt getötet wurden, sagen, Harrell habe ihre Bitten ignoriert, Pentagon-Reporter geben Abzeichen ab. Die Zusammenfassung der Morgennachrichten von The Stranger.
 
 von Vivian McCall
 
 
 
 Kann er das tun? Bruce Harrell sprach laut einer E-Mail-Einladung, die The Stranger erhalten hatte, bei einer Spendenaktion für das Political Action Committee zur Unterstützung seiner Kampagne. Der Wahlautor des Staates…","Slog AM: Mariners Lose, Mothers of Sons Killed by Gun Violence Say Harrell Ignored Their Pleas, Pentagon Reporters Turn In Badges. The Stranger's morning news roundup.
 
 by Vivian McCall
 
 
 
 Can He Do That? Bruce Harrell spoke at a fundraiser for the Political Action Committee supporting his campaign, according to an email invitation obtained by The Stranger. The state’s election aut…","Slog AM: Nautae Perde, Matres Filiorum a Gun Violence Interfecti Dic Harrell Neglecta Placita, Pentagonum Notarios Convertere In Badges. The strange's morning news roundup.
 
 by Vivian McCall
 
 
 
 Numquid potest? Bruce Harrell fundrassor locutus est pro Actione Politica Committee suam expeditionem sustinente, secundum invitationem electronicam a The Stranger impetratam. Electio publica aut…",2025-10-24 04:56:15+00:00
f02fc1b895fddd850f248b52b025f014,2025-10-16T16:30:05Z,'earthquake tectonic',phys.org,en,0.1,Tectonics and climate are shaping an Alaskan ecosystem,"Increased warming in high-latitude wetlands seems poised to increase the activity of methanogens, or methane-producing microbes. These ecosystems are complex places, however, making outcomes hard to predict.",https://phys.org/news/2025-10-tectonics-climate-alaskan-ecosystem.html,https://scx2.b-cdn.net/gfx/news/hires/2025/tectonics-and-climate.jpg,,"Increased warming in high-latitude wetlands seems poised to increase the activity of methanogens, or methane-producing microbes. These ecosystems are complex places, however, making outcomes hard to … [+2592 chars]",,"Tektonik und Klima prägen das Ökosystem Alaskas. Eine zunehmende Erwärmung in Feuchtgebieten in hohen Breiten scheint die Aktivität von Methanogenen oder Methan produzierenden Mikroben zu erhöhen. Diese Ökosysteme sind jedoch komplexe Orte, deren Ergebnisse schwer vorherzusagen sind.","Tectonics and climate are shaping an Alaskan ecosystem. Increased warming in high-latitude wetlands seems poised to increase the activity of methanogens, or methane-producing microbes. These ecosystems are complex places, however, making outcomes hard to predict.","Tectonica et clima Alascan ecosystematis conformant. Calefactionem in humidis summus latitudinis augeri videtur ad augendum methanogenum vel methanum microbes operantem libratum. Haec oecosystemata sunt loca complexa, tamen eventus difficile praedicere.",2025-10-24 04:56:15+00:00
6d7baa1e2250e2e7f3acd60e2bf62d3b,2025-10-17T08:14:08Z,'earthquake damage',www.abc.net.au,en,0.1,"Former Japanese PM Murayama, famous for WWII apology, dies aged 101","Known for his landmark apology for Japan's World War II aggression and the phrases ""deep remorse"" and ""heartfelt apology"", Tomiichi Murayama has died at a hospital in Oita City.",https://www.abc.net.au/news/2025-10-17/ex-japan-prime-minister-tomiichi-murayama-dies-aged-101/105906158,https://live-production.wcms.abc-cdn.net.au/4604619e15813561fa7dd91a46bb0e4a?impolicy=wcms_watermark_news&cropH=1969&cropW=3500&xPos=0&yPos=269&width=862&height=485&imformat=generic,,"Former prime minister Tomiichi Murayama, best known for his landmark apology for Japan's World War II aggression, has died aged 101.
Murayama issued the 1995 proclamation on the 50th anniversary of … [+3206 chars]",,"Der frühere japanische Premierminister Murayama, berühmt für seine Entschuldigungen aus dem Zweiten Weltkrieg, stirbt im Alter von 101 Jahren. Tomiichi Murayama, bekannt für seine bahnbrechende Entschuldigung für Japans Aggression im Zweiten Weltkrieg und die Ausdrücke „tiefe Reue“ und „herzliche Entschuldigung“, ist in einem Krankenhaus in der Stadt Oita gestorben.","Former Japanese PM Murayama, famous for WWII apology, dies aged 101. Known for his landmark apology for Japan's World War II aggression and the phrases ""deep remorse"" and ""heartfelt apology"", Tomiichi Murayama has died at a hospital in Oita City.","Iaponicus prior PM Murayama, excusatione WWII clarus, senex CI moritur. Nota propter notam excusationem pro Iaponia in bello mundano II aggressionis et locutiones ""doloris plenae"" et ""excusationis cordis"", Tomiichi Murayama in nosocomio in urbe Oita mortuus est.",2025-10-24 04:56:15+00:00
550a1cad6245c2a842784415d4f5fcbd,2025-10-17T12:00:00Z,'earthquake victims',www.rollingstone.com,en,0.1,The Predator in the Church Basement,How a millionaire pedophile inside New York’s Riverside Church built the model for a $40 billion youth-sports industry and destroyed children's lives. A Rolling Stone and Sportico investigation,http://www.rollingstone.com/culture/culture-features/riverside-church-basketball-ernie-lorch-abuse-lawsuit-1235446199/,https://www.rollingstone.com/wp-content/uploads/2025/10/RIVERSIDE-Ernie-Lorch-LEAD.jpg?crop=0px%2C564px%2C1800px%2C1015px&resize=1600%2C900,,Byron Walker knew he was in trouble. He’d been late for the Riverside Church Hawks team van departing Upper Manhattan for a tournament in Massachusetts one spring morning in 1977. When the Riverside … [+43433 chars],,Der Raubtier im Keller der Kirche. Wie ein millionenschwerer Pädophiler in der New Yorker Riverside Church das Modell für eine 40-Milliarden-Dollar-Jugendsportindustrie baute und das Leben von Kindern zerstörte. Eine Untersuchung von Rolling Stone und Sportico,The Predator in the Church Basement. How a millionaire pedophile inside New York’s Riverside Church built the model for a $40 billion youth-sports industry and destroyed children's lives. A Rolling Stone and Sportico investigation,Predator in Ecclesia Basement. Quomodo pedophilus nummorum in medio Ecclesiae Fluminis Novi Eboraci exemplar aedificavit pro industria $40 miliarda iuvenum ludorum et vitas puerorum delevit. Lapis volvens et inquisitionis Sportico,2025-10-24 04:56:15+00:00
ecdbdeea5ed85f6cdb61810b88785d50,2025-10-17T14:00:00Z,'earthquake evacuation',journals.plos.org,en,0.1,Spatial factors affecting young females’ disaster exposure in municipalities facing population decline,"Understanding and reducing the risk of natural disasters is crucial for maintaining the economy and society. Since Japan is a disaster-prone country and the most advanced nation in the world regarding aging and population decline, it necessitates a natural di…",https://journals.plos.org/plosone/article?id=10.1371/journal.pone.0334706,https://journals.plos.org/plosone/article/figure/image?id=10.1371/journal.pone.0334706.g014&size=inline,,"Abstract
Understanding and reducing the risk of natural disasters is crucial for maintaining the economy and society. Since Japan is a disaster-prone country and the most advanced nation in the worl… [+64203 chars]",,"Räumliche Faktoren, die die Katastrophenexposition junger Frauen in Gemeinden beeinflussen, die mit einem Bevölkerungsrückgang konfrontiert sind. Das Verständnis und die Reduzierung des Risikos von Naturkatastrophen ist für den Erhalt von Wirtschaft und Gesellschaft von entscheidender Bedeutung. Da Japan ein katastrophengefährdetes Land und in Bezug auf Alterung und Bevölkerungsrückgang das am weitesten fortgeschrittene Land der Welt ist, ist eine natürliche Anpassung erforderlich.","Spatial factors affecting young females’ disaster exposure in municipalities facing population decline. Understanding and reducing the risk of natural disasters is crucial for maintaining the economy and society. Since Japan is a disaster-prone country and the most advanced nation in the world regarding aging and population decline, it necessitates a natural di…","Facitores locales afficientes clades feminarum iuvenum in municipiis detectio contra populationem declinationem. Intellectus et minuens periculum calamitatum naturalium magnum est ad obtinendam oeconomiam ac societatem. Cum Iaponia patria calamitatis prona est et gens antecedens in mundo circa senescit et hominum declinatio, naturalis di…",2025-10-24 04:56:15+00:00
0456fc789ff159337fd09c75ba6be773,2025-10-17T15:18:11Z,'earthquake disaster',www.ibtimes.com,en,0.1,Turkish Experts Await Israeli Go Ahead To Help Recover Bodies In Gaza,"A team of Turkish disaster response specialists is stationed at the Egyptian border, awaiting Israeli authorisation to enter Gaza and help in search and recovery operations, a Turkish official told AFP on Friday.",https://www.ibtimes.com/turkish-experts-await-israeli-go-ahead-help-recover-bodies-gaza-3787419,https://d.ibtimes.com/en/full/4629342/foreign-minister-hakan-fidan-says-there-are-ongoing-talks-formation-stability-force-gaza.jpg,,"A team of Turkish disaster response specialists is stationed at the Egyptian border, awaiting Israeli authorisation to enter Gaza and help in search and recovery operations, a Turkish official told A… [+3087 chars]",,"Türkische Experten warten darauf, dass Israel bereit ist, bei der Bergung von Leichen in Gaza zu helfen. Ein Team türkischer Katastrophenschutzspezialisten ist an der ägyptischen Grenze stationiert und wartet auf die Genehmigung Israels, nach Gaza einzureisen und bei Such- und Bergungsoperationen zu helfen, sagte ein türkischer Beamter am Freitag gegenüber AFP.","Turkish Experts Await Israeli Go Ahead To Help Recover Bodies In Gaza. A team of Turkish disaster response specialists is stationed at the Egyptian border, awaiting Israeli authorisation to enter Gaza and help in search and recovery operations, a Turkish official told AFP on Friday.","Turcorum periti Exspecta Israelis Perge ad Auxilium Recover corpora in Gazam. Manipulus calamitatis Turcicae in confinio Aegyptiorum responsionem adhibet, exspectans Israelis potestatem ut Gazam intraret et auxilium quaerendi et recuperandi operationes, officialis Turcicus die Veneris AFP nuntiavit.",2025-10-24 04:56:15+00:00
313018eef8291217e95751e056cd3f1a,2025-10-17T21:27:16Z,'earthquake charity',freerepublic.com,en,0.1,"The Pallyweid ""genocide"" lie (Updated Oct/2025)","* __ The ""genocide"" LIE [October 16, 2025] The Genocide Lie: Why the Accusation Against Israel Collapses Under Scrutiny.In the months since ""Palestine"" regime Hamas’s October 7 attacks, there has been a full-force campaign to frame Israel’s counteroffensive i…",https://freerepublic.com/focus/f-bloggers/4347022/posts,,,"Skip to comments.
The Pallyweid ""genocide"" lie (Updated Oct/2025)Pallyweid Genocide Lie archived ^
 | Oct 16, 2025
Posted on 10/17/2025 2:27:16 PM PDT by Words Matter 
* __ 
The ""genocide"" LIE [… [+169814 chars]",,"Die Pallyweid-„Völkermord“-Lüge (aktualisiert Okt. 2025). * __ Die „Völkermord“-LÜGE [16. Oktober 2025] Die Völkermord-Lüge: Warum die Anschuldigungen gegen Israel bei genauerer Betrachtung scheitern. In den Monaten seit den Anschlägen des „Palästina“-Regimes Hamas am 7. Oktober gab es eine umfassende Kampagne, um Israels Gegenoffensive zu prägen …","The Pallyweid ""genocide"" lie (Updated Oct/2025). * __ The ""genocide"" LIE [October 16, 2025] The Genocide Lie: Why the Accusation Against Israel Collapses Under Scrutiny.In the months since ""Palestine"" regime Hamas’s October 7 attacks, there has been a full-force campaign to frame Israel’s counteroffensive i…","The Pallyweid ""genocide"" (Updated Oct/2025). * __ The ""genocidia"" LIE [October 16 2025] The Genocide Lie: Cur Accusatio Contra Israel Collapses Sub Scrutiny. In mensibus ex quo ""Palaestinae"" regimen Hamas's Octobri 7 oppugnat, plena vis expeditionis facta est ad componendas Israeli contrarias i…",2025-10-24 04:56:15+00:00
94ba864f2477220321680925b05bad63,2025-10-18T01:00:00Z,'earthquake damage',www.housedigest.com,en,0.1,16 Types Of Insurance Homeowners May Need And Why,"Think your basic home insurance policy is all there is? Think again. There's a reason it's called 'basic', after all. Here are 16 more policies you should...",https://www.housedigest.com/1996294/types-of-insurance-homeowners-need/,https://s.yimg.com/ny/api/res/1.2/BNAI3VCDOuqMfLsGd.A.bA--/YXBwaWQ9aGlnaGxhbmRlcjt3PTEyMDA7aD02NzQ-/https://media.zenfs.com/en/house_digest_articles_842/68754b67512cfc1f0520d05bb4a6b2f0,,"As famed surrealist writer Franz Kafka was once believed to say: ""Better to have, and not need, than to need, and not have."" And while insurance can feel like a logistical nuisance for homeowners, it… [+12487 chars]",,"16 Arten von Versicherungen, die Hausbesitzer möglicherweise benötigen, und warum. Denken Sie, dass Ihre grundlegende Hausratversicherung alles ist, was es gibt? Denken Sie noch einmal darüber nach. Es gibt schließlich einen Grund, warum es „Basic“ heißt. Hier sind 16 weitere Richtlinien, die Sie beachten sollten...","16 Types Of Insurance Homeowners May Need And Why. Think your basic home insurance policy is all there is? Think again. There's a reason it's called 'basic', after all. Here are 16 more policies you should...","16 Genera Insurance Homeowners opus et quare. Cogitas te basic domum insurance policy est? Cogita iterum. Causa est quod 'basic' dicitur, post omnes. Hic sunt 16 plura consilia debes...",2025-10-24 04:56:15+00:00
b129672236348ce00857ae51bd775a02,2025-10-18T06:05:43Z,'earthquake magnitude',www.aljazeera.com,en,0.1,Thousands evacuate Philippine coast as Tropical Storm Fengshen approaches,"The country is hit by some 20 storms and typhoons a year, striking disaster-prone areas where millions live in poverty.",https://www.aljazeera.com/news/2025/10/18/thousands-evacuate-philippine-coast-as-tropical-storm-fengshen-approaches,https://www.aljazeera.com/wp-content/uploads/2025/09/AFP__20250923__76FA9WK__v1__HighRes__PhilippinesWeatherTyphoonClimateRagasa-1758608788.jpg?resize=1920%2C1440,http://web.archive.org/web/20251109145509/https://www.aljazeera.com/news/2025/10/18/thousands-evacuate-philippine-coast-as-tropical-storm-fengshen-approaches,"Thousands of residents of a Philippine island have fled their homes along the Pacific coast as weather experts warned of coastal flooding ahead of the approach of Tropical Storm Fengshen, rescue offi… [+1864 chars]",,"Tausende evakuieren die philippinische Küste, als sich der Tropensturm Fengshen nähert. Das Land wird jedes Jahr von rund 20 Stürmen und Taifunen heimgesucht, die katastrophengefährdete Gebiete treffen, in denen Millionen Menschen in Armut leben.","Thousands evacuate Philippine coast as Tropical Storm Fengshen approaches. The country is hit by some 20 storms and typhoons a year, striking disaster-prone areas where millions live in poverty.","Milia oram Philippinam evacuant sicut Tropical Fengshen appropinquat. Patria quibusdam XX procellis et typhonibus per annum pulsatur, locis calamitatibus proclivis in quibus decies centena millia in paupertate vivunt.",2025-10-24 04:56:15+00:00
50d6a925388fe86147042f65e8b21fb6,2025-10-19T09:55:00Z,'earthquake damage',www.vintag.es,en,0.1,"Tower of Toghrul, Rey, Iran, ca. 1860s","The Tower of Toghrul, also transliterated as Tughrul or Tuğrul Tower, is a 12th-century monument, located in the city of Rey, Tehran provinc...",https://www.vintag.es/2025/10/tower-of-toghrul.html,https://blogger.googleusercontent.com/img/b/R29vZ2xl/AVvXsEjg-n-y63j6Rkdat6UUdfKzA18_LPbm3sFeGAxKXA1zYH8dJrNUhRW41q8AUVIYk77bhLwKflg8YSnLB04QvFFwNdz5pUYoSQssZI9spu6qaQbr5gRGv9vZp2thT2_z7lDRBki0V0TYWO58jXDFaY0gm0vpfxsZcR0TGPnSYtZfI_SL4y4UdmE4jHdmkZE/w1200-h630-p-k-no-nu/tower-of-toghrul-1.jpg,,"The Tower of Toghrul, also transliterated as Tughrul or Tuğrul Tower, is a 12th-century monument, located in the city of Rey, Tehran province, Iran. Toghrul Tower is near Rashkan Castle. This photo w… [+2577 chars]",,"Turm von Toghrul, Rey, Iran, ca. 1860er Jahre. Der Turm von Toghrul, auch Tughrul oder Tuğrul-Turm genannt, ist ein Denkmal aus dem 12. Jahrhundert in der Stadt Rey in der Provinz Teheran.","Tower of Toghrul, Rey, Iran, ca. 1860s. The Tower of Toghrul, also transliterated as Tughrul or Tuğrul Tower, is a 12th-century monument, located in the city of Rey, Tehran provinc...","Turris Toghrul, Rey, Iran, ca. 1860s. Turris Toghrul, etiam Tughrul seu Tuğrul transliterata, est monumentum XII saeculi, situm in urbe Rey, provinciae Tehran.",2025-10-24 04:56:15+00:00
7f0d783becc835e708546e8df539824e,2025-10-19T13:04:01Z,'earthquake death',www.businessinsider.com,en,0.1,The most haunted building in every US state,"From the infamous Amityville Horror House to the Villisca Axe Murder House, the US is home to some horrifying places with dark histories.",https://www.businessinsider.com/most-haunted-house-building-every-us-state,https://i.insider.com/66f2f8ead17aa3c7b2b5930e?width=1000&format=jpeg,,"The infamous ""Amityville Horror House"" in Long Island, New York.Paul Hawthorne/Getty Images
<ul><li>Historic buildings often collect urban legends over the course of their long histories.</li><li>Fo… [+30638 chars]",,Das am meisten heimgesuchte Gebäude in jedem US-Bundesstaat. Vom berüchtigten Amityville Horror House bis zum Villisca Axe Murder House gibt es in den USA einige schreckliche Orte mit dunkler Geschichte.,"The most haunted building in every US state. From the infamous Amityville Horror House to the Villisca Axe Murder House, the US is home to some horrifying places with dark histories.","The most uaded building in every US state. Ab infami Amityville Horror Domo ad Villisca Axe Murder Domum, US est domus quibusdam locis horrendis obscuris historiis.",2025-10-24 04:56:15+00:00
13f83c1a379de94906581eb22e031db5,2025-10-20T05:32:00Z,'earthquake tectonic',www.hospitalitynet.org,en,0.1,Sense of Place and Luxury Group Experiences with Canaves Collection in Santorini,"Santorini possesses one of the most irrefutably incredible landscapes in the world. From its soaring cliffs overlooking the calm azure Aegean Sea to the white, red, and black sand beaches formed by eons of volcanic activity, Thera, the island’s official name …",https://www.hospitalitynet.org/opinion/4129266.html,https://www.hospitalitynet.org/picture/social_153189536.jpg?t=1759923568,,"Santorini possesses one of the most irrefutably incredible landscapes in the world. From its soaring cliffs overlooking the calm azure Aegean Sea to the white, red, and black sand beaches formed by e… [+14185 chars]",,"Ortsgefühl und luxuriöse Gruppenerlebnisse mit der Canaves Collection auf Santorini. Santorini besitzt eine der unbestreitbar unglaublichsten Landschaften der Welt. Von den hohen Klippen mit Blick auf das ruhige azurblaue Ägäische Meer bis hin zu den weißen, roten und schwarzen Sandstränden, die durch Äonen vulkanischer Aktivität entstanden sind: Thera, der offizielle Name der Insel …","Sense of Place and Luxury Group Experiences with Canaves Collection in Santorini. Santorini possesses one of the most irrefutably incredible landscapes in the world. From its soaring cliffs overlooking the calm azure Aegean Sea to the white, red, and black sand beaches formed by eons of volcanic activity, Thera, the island’s official name …","Sensus Place et Luxuria Group Experientiae apud Canaves Collection in Santorini. Santorini unum tenet in mundo incredibilis landscapes. Ex scopulis volans tranquillitatem caeruleam Aegaeo mari imminens ad litora harenae alba, rubra, nigra, per eons volcanicae actionis formatae, Thera, officialis insulae nomen.",2025-10-24 04:56:15+00:00
