index,published,keyword,domain,language,valid,title,description,url,image,archive,content,quote,de,en,la,added
9d4f148f8c8e7f4338a5d312f5a7d6f6,2026-06-08T02:20:42Z,'earthquake tectonic',en.antaranews.com,en,0.9,Tsunami early warning issued after 7.7M quake in Sulawesi Sea,"The Meteorology, Climatology, and Geophysics Agency (BMKG) issued an updated tsunami early warning following a magnitude 7.7 tectonic earthquake that struck ...",https://en.antaranews.com/news/418337/tsunami-early-warning-issued-after-77m-quake-in-sulawesi-sea,https://cdn.antaranews.com/cache/1200x800/2026/06/08/270700.jpg,http://web.archive.org/web/20260609063415/https://en.antaranews.com/news/418337/tsunami-early-warning-issued-after-77m-quake-in-sulawesi-sea,"Jakarta (ANTARA) - The Meteorology, Climatology, and Geophysics Agency (BMKG) issued an updated tsunami early warning following a magnitude 7.7 tectonic earthquake that struck the Sulawesi Sea on Mon… [+2128 chars]",,"Tsunami-Frühwarnung nach 7,7-Millionen-Beben in der Sulawesi-See ausgegeben. Die Agentur für Meteorologie, Klimatologie und Geophysik (BMKG) hat nach einem tektonischen Erdbeben der Stärke 7,7 eine aktualisierte Tsunami-Frühwarnung herausgegeben.","Tsunami early warning issued after 7.7M quake in Sulawesi Sea. The Meteorology, Climatology, and Geophysics Agency (BMKG) issued an updated tsunami early warning following a magnitude 7.7 tectonic earthquake that struck ...","Tsunami praenuntia edita post 7.7M mota in Mare Sulawesi. Meteorologia, Climatologia, et Agency Geophysica (BMKG) renovatio tsunami praematuro edita est sequente magnitudine 7.7 terrae motus tectonici qui percussus est.",2026-06-13 08:04:10+00:00
47c8c44350d15673b3bc668624a5b3f8,2026-06-08T03:50:42Z,'earthquake',en.antaranews.com,en,0.9,Mindanao 7.7M earthquake triggered by plate subduction: BMKG,"The Meteorology, Climatology, and Geophysics Agency (BMKG) reported that a magnitude 7.7 tectonic earthquake on the southern coast of Mindanao, Philippines, ...",https://en.antaranews.com/news/418343/mindanao-77m-earthquake-triggered-by-plate-subduction-bmkg,https://cdn.antaranews.com/cache/1200x800/2026/06/08/IMG-20260608-WA0005_copy_1600x1200.jpg,,"Manado, North Sulawesi (ANTARA) - The Meteorology, Climatology, and Geophysics Agency (BMKG) reported that a magnitude 7.7 tectonic earthquake on the southern coast of Mindanao, Philippines, on Monda… [+2553 chars]",,"Erdbeben der Stärke 7,7 M in Mindanao, ausgelöst durch Plattensubduktion: BMKG. Die Agentur für Meteorologie, Klimatologie und Geophysik (BMKG) berichtete, dass ein tektonisches Erdbeben der Stärke 7,7 an der Südküste von Mindanao, Philippinen, ...","Mindanao 7.7M earthquake triggered by plate subduction: BMKG. The Meteorology, Climatology, and Geophysics Agency (BMKG) reported that a magnitude 7.7 tectonic earthquake on the southern coast of Mindanao, Philippines, ...","Mindanao 7.7M terrae motus Urguet subductione lamella: BMKG. Meteorologia, Climatologia et Geophysica Procuratio (BMKG) nuntiaverunt magnitudinem 7.7 terrae motus tectonici in ora meridiana Mindanao, Philippines, ...",2026-06-13 08:04:10+00:00
7fe097ecaf8a1c90f819d826ab55f86d,2026-06-10T05:30:23Z,'earthquake magnitude',english.gossiplankanews.com,en,0.9,Horrific experiences of the 7.8 Philippine earthquake (videos),"A powerful earthquake occurred on June 8, 2026, at approximately 7:37 AM local time, in the sea area off the coast of Mindanao in the Southern Philippines. This earthquake, with a magnitude of 7.8 on the Richter scale, is considered one of the most powerful e…",https://english.gossiplankanews.com/2026/06/horrific-experiences-of-78-philippine.html,https://lh3.googleusercontent.com/blogger_img_proxy/AEn0k_vOXbiJmqdJMd1UII6GGwodDqAaRF92_fsha4pyS9LkROjbZfGfvfoFyxkQ1cZ6x1nkx3XZ1zfoz5dIqY8Hvsinquwmc2-v1wue2lvPNZsiJkcW7z51PgJTW1uVjsgtTJfnWh2XcSIZsCEVeimQX-3fiyX8UrxjMxkXYOhn=w1600,,"A powerful earthquake occurred on June 8, 2026, at approximately 7:37 AM local time, in the sea area off the coast of Mindanao in the Southern Philippines. This earthquake, with a magnitude of 7.8 on… [+2371 chars]",,"Schreckliche Erlebnisse des Erdbebens der Stärke 7,8 auf den Philippinen (Videos). Ein starkes Erdbeben ereignete sich am 8. Juni 2026 gegen 7:37 Uhr Ortszeit im Seegebiet vor der Küste von Mindanao im Süden der Philippinen. Dieses Erdbeben mit einer Stärke von 7,8 auf der Richterskala gilt als eines der stärksten Erdbeben der Welt.","Horrific experiences of the 7.8 Philippine earthquake (videos). A powerful earthquake occurred on June 8, 2026, at approximately 7:37 AM local time, in the sea area off the coast of Mindanao in the Southern Philippines. This earthquake, with a magnitude of 7.8 on the Richter scale, is considered one of the most powerful e…","Horribiles experientiae 7.8 terrae motus Philippinarum (videos). Terrae motus validus factus est die 8 Iunii 2026, hora fere 7:37 AM locali, in area maritima a litore Mindanao in Philippinis Australibus. Hic terrae motus, magnitudine 7.8 in libra Richter, unus potentissimus habetur e…",2026-06-13 08:04:10+00:00
348fae433804fd1ad543007d0b28c311,2026-06-12T11:30:00Z,'earthquake death',www.motherjones.com,en,0.2,The Supreme Court’s Pending Decision on Haitians’ Humanitarian Status Is a Matter of “Life and Death”,"Vilès Dorsainvil has thought a lot about desperation recently. Specifically, what desperation forces people to do, and the tragedy it seems to attract. As a Haitian immigrant and the executive director of the Haitian Support Center in Springfield, Ohio, he ha…",https://www.motherjones.com/politics/2026/06/the-supreme-courts-pending-tps-decision-on-haitians-humanitarian-status-is-a-matter-of-life-and-death/,https://www.motherjones.com/wp-content/uploads/2026/06/20260611_scotus-tps-haitians_2000.jpg?w=1200&h=630&crop=1,http://web.archive.org/web/20260613035129/https://www.motherjones.com/politics/2026/06/the-supreme-courts-pending-tps-decision-on-haitians-humanitarian-status-is-a-matter-of-life-and-death/,"Get your news from a source thats not owned and controlled by oligarchs. Sign up for the free Mother Jones Daily.
Vilès Dorsainvil has thought a lot about desperation recently. Specifically, what de… [+22973 chars]",,"Die ausstehende Entscheidung des Obersten Gerichtshofs über den humanitären Status der Haitianer ist eine Frage von „Leben und Tod“. Vilès Dorsainvil hat in letzter Zeit viel über Verzweiflung nachgedacht. Insbesondere geht es darum, wozu die Verzweiflung die Menschen zwingt, und welche Tragödie sie scheinbar nach sich zieht. Als haitianischer Einwanderer und Geschäftsführer des Haitian Support Center in Springfield, Ohio, hat er…","The Supreme Court’s Pending Decision on Haitians’ Humanitarian Status Is a Matter of “Life and Death”. Vilès Dorsainvil has thought a lot about desperation recently. Specifically, what desperation forces people to do, and the tragedy it seems to attract. As a Haitian immigrant and the executive director of the Haitian Support Center in Springfield, Ohio, he ha…","Summi Court pendentes Decisiones de Haitians Status Humanitarius Est res ""Vitae et Mors"". Vilès Dorsainvil multa de desperatione nuper cogitavit. Speciatim, quod desperatio cogit homines facere, et tragoedia videtur allicere. Haitian incolam et moderatorem exsecutivum Haitian Support Centre in Springfield, Ohio, he ha…",2026-06-13 15:21:34+00:00
b09d49d096eeaa15da080707a0fbb7aa,2026-06-09T10:54:00Z,'earthquake death',www.dw.com,en,0.3,"Philippines: Large Mindanao quake displaced roughly 20,000","Rescuers are still searching ruined buildings in the Philippines for anyone possibly trapped inside after Monday's quake. The tremor claimed at least 37 lives and forced roughly 20,000 people to leave their homes. Rescuers continued their search of damaged an…",https://www.dw.com/en/mindanao-quake-rescue-efforts-continue-roughly-20000-displaced/a-77470139,https://static.dw.com/image/77471165_6.jpg,http://web.archive.org/web/20260609170711/https://www.dw.com/en/mindanao-quake-rescue-efforts-continue-roughly-20000-displaced/a-77470139,"Rescuers continued their search of damaged and collapsed buildings in General Santos city and the surrounding area on Tuesday, a day after the strongest earthquake to hit the Philippines this year ki… [+4670 chars]",,"Philippinen: Großes Erdbeben in Mindanao hat etwa 20.000 Menschen vertrieben. Nach dem Beben am Montag durchsuchen Rettungskräfte noch immer zerstörte Gebäude auf den Philippinen nach Personen, die möglicherweise darin eingeschlossen sind. Das Beben forderte mindestens 37 Todesopfer und zwang rund 20.000 Menschen, ihre Häuser zu verlassen. Retter setzten ihre Suche nach beschädigten und… fort.","Philippines: Large Mindanao quake displaced roughly 20,000. Rescuers are still searching ruined buildings in the Philippines for anyone possibly trapped inside after Monday's quake. The tremor claimed at least 37 lives and forced roughly 20,000 people to leave their homes. Rescuers continued their search of damaged an…","Philippinae: Magnae Mindanao motae emoti circiter 20000. Restores adhuc aedificia ruinosa in Philippinis quaerunt, si quis intra motus Lunae capti possit. Tremor saltem 37 vitam petitam et circiter viginti millia hominum domos suas relinquere coegit. Rescuers eorum inquisitionem quassatas an…",2026-06-13 15:21:34+00:00
92aac701ba2298194b5a670b3795d65f,2026-06-09T11:34:26Z,'earthquake death',www.dailymail.com,en,0.3,Boyfriend who murdered Old Bailey judge's daughter is jailed for 23 years after he stabbed her to death and blew up their £1.4m home in gas explosion,"Clifton George, 45, killed his partner Annabel Rook, 46, by stabbing her 31 times during a row at their east London home after she had said they should end their 10-year relationship.",https://www.dailymail.com/news/article-15885541/Boyfriend-murdered-Old-Bailey-judge-daughter-jailed-23.html,https://i.dailymail.com/1s/2026/06/09/12/109223863-0-image-m-9_1781004846728.jpg,,"An electrician who stabbed a judge's daughter to death in a frenzied rage before blowing up their home in a gas explosion has been handed a life sentence and jailed for 23 years.
Clifton George, 45,… [+8224 chars]",,"Freund, der die Tochter eines Richters aus Old Bailey ermordet hat, wird zu 23 Jahren Gefängnis verurteilt, nachdem er sie erstochen und ihr 1,4 Millionen Pfund teures Haus durch eine Gasexplosion in die Luft gesprengt hat. Clifton George, 45, tötete seine Partnerin Annabel Rook, 46, indem er während eines Streits in ihrem Haus im Osten Londons 31 Mal auf sie einstach, nachdem sie gesagt hatte, sie sollten ihre zehnjährige Beziehung beenden.","Boyfriend who murdered Old Bailey judge's daughter is jailed for 23 years after he stabbed her to death and blew up their £1.4m home in gas explosion. Clifton George, 45, killed his partner Annabel Rook, 46, by stabbing her 31 times during a row at their east London home after she had said they should end their 10-year relationship.","Boyfriend qui Veterem Bailey iudicis filiam occidit, inclusus est post XXIII annos postquam eam ad mortem transfodit et coortus est domum suam in £1.4m explosione gas. 45 Georgius Clifton, Annabel Rook socium suum interfecit 46, fodiendo eam 31 vicibus in ordine ad domum suam orientalem Londinii, postquam dixerat se finiendae necessitudinis suae 10 annorum.",2026-06-13 15:21:34+00:00
9494b676617c4c7301791c5e73a7d000,2026-06-10T23:57:09Z,'earthquake death',www.dailymail.com,en,0.3,"Graduate son of Karcher jetwash tycoon shot himself dead with air pistol in front of his father in family's £1.5m farmhouse after struggling to find first 'proper job', inquest hears","James Keeping, 25, who had been suffering mental health problems, had been drinking and was argumentative on the day he died at the family's £1.5 million Oxfordshire farmhouse.",https://www.dailymail.com/news/article-15889339/Graduate-son-Karcher-jetwash-tycoon-shot-dead-air-pistol-father-familys-1-5m-farmhouse-struggling-proper-job-inquest-hears.html,https://i.dailymail.com/1s/2026/06/10/16/109258299-0-image-m-16_1781105155922.jpg,http://web.archive.org/web/20260611095432/https://www.dailymail.com/news/article-15889339/Graduate-son-Karcher-jetwash-tycoon-shot-dead-air-pistol-father-familys-1-5m-farmhouse-struggling-proper-job-inquest-hears.html,"A manufacturing tycoon has described the horrifying moment his troubled son held an air pistol to his head and shot himself dead - but told how he still believes his death was an accident.
James Kee… [+5692 chars]",,"Der Sohn des Absolventen des Karcher-Jetwash-Tycoons erschoss sich vor den Augen seines Vaters im 1,5 Millionen Pfund teuren Bauernhaus seiner Familie mit einer Luftpistole, nachdem er darum gekämpft hatte, den ersten „richtigen Job“ zu finden, wie die gerichtliche Untersuchung ergab. Der 25-jährige James Keeping, der unter psychischen Problemen litt, hatte am Tag seines Todes im 1,5 Millionen Pfund teuren Bauernhaus der Familie in Oxfordshire Alkohol getrunken und war streitsüchtig.","Graduate son of Karcher jetwash tycoon shot himself dead with air pistol in front of his father in family's £1.5m farmhouse after struggling to find first 'proper job', inquest hears. James Keeping, 25, who had been suffering mental health problems, had been drinking and was argumentative on the day he died at the family's £1.5 million Oxfordshire farmhouse.","Graduatus filius Karcher jetwash tycoon iecit se mortuum cum pistol aere ante patrem suum in £1.5m villae familiae, postquam primum ""officium proprium"" invenire contendit, inquisitionem audit. James Keeping, XXV, qui problemata valetudine mentis laboraverat, biberat et disputabat quo die mortuus est in villa familiae Oxon.",2026-06-13 15:21:34+00:00
262940117623a3488cf441f5f3964dfc,2026-06-11T14:45:51Z,'earthquake death',mediatakeout.com,en,0.3,Snoop Dogg Exposed For Having ‘SECRET Side Kids’ w/ European Women!,"THE OVERSEAS SECRET BABIES REVEALED?! Daz Dillinger Drops Massive Bombshell Accusing Snoop Dogg Of Fathering Multiple Outside Children From Low-Key International Affairs! Honey, the West Coast hip-hop foundation has officially been hit with an absolute, categ…",https://mediatakeout.com/snoop-dogg-exposed-for-having-secret-side-kids-w-european-women/,https://mediatakeout.com/wp-content/uploads/2025/06/gettyimages-2219392297-612x612-1.jpg,,"Honey, the West Coast hip-hop foundation has officially been hit with an absolute, category-five earthquake, and the devastation is spilling all over the timeline! Media Take Out has been tracking a … [+3905 chars]",,"Snoop Dogg wird entlarvt, weil er „SECRET Side Kids“ mit europäischen Frauen hat!. DIE ÜBERSEE-GEHEIMNIS-BABYS ENTHÜLLT?! Daz Dillinger lässt eine gewaltige Bombe platzen, indem er Snoop Dogg beschuldigt, mehrere fremde Kinder aus unauffälligen internationalen Angelegenheiten gezeugt zu haben! Honey, die Hip-Hop-Stiftung der Westküste wurde offiziell mit einem absoluten, kategorischen Hit getroffen …","Snoop Dogg Exposed For Having ‘SECRET Side Kids’ w/ European Women!. THE OVERSEAS SECRET BABIES REVEALED?! Daz Dillinger Drops Massive Bombshell Accusing Snoop Dogg Of Fathering Multiple Outside Children From Low-Key International Affairs! Honey, the West Coast hip-hop foundation has officially been hit with an absolute, categ…","Snoop Dogg Exposita Pro Habentes SECRETA Latus Kids w/Europaeae!. Transmarinas infantes SECRETO REVELATA?! Daz Dillinger Guttae Massive Bombshell Accusantes Snoop Dogg De Patre Multiplices Extra Pueri Ex Low-Key Internationalis Negotiis! Mel, Occidentalis Coast Fundamentum hip-hope absolutum publice percussum est, categ…",2026-06-13 15:21:34+00:00
b99060e1cbd76a955a0b796d0366f27a,2026-06-12T02:38:00Z,'earthquake death',www.channelnewsasia.com,en,0.3,"Rain, aftershocks hamper rescuers as Philippine quake toll hits 55",The number of missing stood at 31 as reports from local jurisdictions trickled in.,https://www.channelnewsasia.com/asia/philippines-earthquake-toll-55-rain-aftershocks-6178401,"https://dam.mediacorp.sg/image/upload/s--GM5s5oGc--/c_crop,h_900,w_1600,x_0,y_11/c_fill,g_auto,h_676,w_1200/fl_relative,g_south_east,l_mediacorp:cna:watermark:2024-04:reuters_1,w_0.1/f_auto,q_auto/v1/mediacorp/cna/image/2026/06/12/2026-06-10t050500z_1654722426_rc2oqlaiag63_rtrmadp_3_philippines-quake.jpg?itok=_fM8LDnz",,"MANILA: Rescuers battling rain and aftershocks cleared roads and searched for the missing in the southern Philippines on Friday (Jun 12) as the death toll from a major quake rose to 55.
The 7.8-magn… [+1345 chars]",,"Regen und Nachbeben behindern die Rettungskräfte, da die Zahl der Beben auf den Philippinen 55 erreicht. Die Zahl der Vermissten lag bei 31, als Berichte aus örtlichen Gerichtsbarkeiten eintrafen.","Rain, aftershocks hamper rescuers as Philippine quake toll hits 55. The number of missing stood at 31 as reports from local jurisdictions trickled in.","Pluviis, afterslocks impediunt liberatores ut mota Philippinarum vectigal 55. Numerus absentium in 31  stetit, sicut relationes ex iurisdictionibus localibus in manarunt.",2026-06-13 15:21:34+00:00
a46d569695e60963d73408d3567455e0,2026-06-10T03:57:37Z,'earthquake death',www.channelnewsasia.com,en,0.6,Death toll from Philippines quake rises to 46,"The 7.8-magnitude tremor just off the coast of Mindanao on Monday brought down buildings, triggered landslides and set off tsunami warnings across a swathe of the southern island.",https://www.channelnewsasia.com/asia/philippines-earthquake-death-toll-46-general-santos-6173126,"https://dam.mediacorp.sg/image/upload/s--b8e7tXbB--/c_crop,h_449,w_799,x_1,y_1/c_fill,g_auto,h_676,w_1200/fl_relative,g_south_east,l_mediacorp:cna:watermark:2024-04:reuters_1,w_0.1/f_auto,q_auto/v1/one-cms/core/2026-06-09T125023Z_1_LYNXMPEM580XE_RTROPTP_3_PHILIPPINES-QUAKE.JPG?itok=Hzyz88D8",http://web.archive.org/web/20260610083616/https://www.channelnewsasia.com/asia/philippines-earthquake-death-toll-46-general-santos-6173126,"GENERAL SANTOS, Philippines: Rescuers in the southern Philippines pulled a body from the rubble of a collapsed supermarket on Wednesday (Jun 10), as the death toll from a major earthquake climbed to … [+1054 chars]",,"Die Zahl der Todesopfer durch das Beben auf den Philippinen steigt auf 46. Das Beben der Stärke 7,8 direkt vor der Küste von Mindanao brachte am Montag Gebäude zum Einsturz, löste Erdrutsche aus und löste in einem Teil der südlichen Insel Tsunami-Warnungen aus.","Death toll from Philippines quake rises to 46. The 7.8-magnitude tremor just off the coast of Mindanao on Monday brought down buildings, triggered landslides and set off tsunami warnings across a swathe of the southern island.","Mortuus vectigal ex Philippinis commotus oritur 46. 7.8-magnitudo tremor in litore Mindanao die Lunae aedificia deduxit, utitur proruit et monita tsunami per fasciculum insulae meridionalis statuit.",2026-06-13 15:21:34+00:00
5622e96a422422b894a90512540e00e6,2026-06-11T00:00:00Z,'earthquake death',www.jw.org,en,0.7,NEWS RELEASES | Destructive Earthquake Shakes the Southern Philippines,,https://www.jw.org/en/news/region/philippines/Destructive-Earthquake-Shakes-the-Southern-Philippines/,https://cms-imgp.jw-cdn.org/img/p/702026116/univ/art/702026116_univ_lsr_lg.jpg,,"On June 8, 2026, a 7.8-magnitude earthquake struck several provinces on the Philippine island of Mindanao. This was one of the most powerful earthquakes to strike the Philippines in the past 50 years… [+1517 chars]",,Pressemitteilungen | Verheerendes Erdbeben erschüttert den Süden der Philippinen.,NEWS RELEASES | Destructive Earthquake Shakes the Southern Philippines. ,NEWS RELEASES | Destructive Earthquake Shakes the Southern Philippines.,2026-06-13 15:21:34+00:00
567b8f17a887830b4d4b91de45c38b49,2026-06-09T05:44:59Z,'earthquake death',www.bbc.com,en,0.9,Hundreds of aftershocks jolt Philippines as officials say death toll could rise,Dozens of people are dead and hundreds more injured following an earthquake in the country's south.,https://www.bbc.com/news/articles/ckg50pypn2eo,https://ichef.bbci.co.uk/news/1024/branded_news/3df8/live/9157b230-63b5-11f1-bdb9-8d63aa1ed6be.jpg,http://web.archive.org/web/20260609184721/https://www.bbc.com/news/articles/ckg50pypn2eo,"""We hope the death toll does not increase further, but we are expecting it to move. Our priority today is search and rescue,"" Bernardo Alejandro, assistant secretary of the agency supervising disaste… [+27 chars]",,"Hunderte Nachbeben erschüttern die Philippinen, da Beamte sagen, dass die Zahl der Todesopfer steigen könnte. Bei einem Erdbeben im Süden des Landes sind Dutzende Menschen ums Leben gekommen und Hunderte weitere verletzt.",Hundreds of aftershocks jolt Philippines as officials say death toll could rise. Dozens of people are dead and hundreds more injured following an earthquake in the country's south.,Centum aftershocks salebratae Philippinae ut magistratus dicunt theloneum mortis posse oriri. Justorum hominum mortui sunt et centeni plus laesi sequentes terrae motus in regione meridiei.,2026-06-13 15:21:34+00:00
6fa577e15c4ee0674ee48e77452945dd,2026-06-09T08:30:00Z,'earthquake',www.cbc.ca,en,0.9,"Members of N.L.'s Filipino community shocked, heartbroken following earthquake","Members of Newfoundland and Labrador's Filipino community were devastated to learn of the deadly earthquake that hit the country on Monday, and hope to make sure those impacted are supported.",https://www.cbc.ca/news/canada/newfoundland-labrador/nl-reaction-philippines-earthquake-9.7227255,"https://i.cbc.ca/ais/112190a6-566e-4f02-abcf-5f2c66cb7daa,1780925012142/full/max/0/default.jpg?im=Crop%2Crect%3D%280%2C558%2C5351%2C3009%29%3BResize%3D620",http://web.archive.org/web/20260609115452/https://www.cbc.ca/news/canada/newfoundland-labrador/nl-reaction-philippines-earthquake-9.7227255,"Members of Newfoundland and Labrador's Filipino community were devastated to learn of the deadly earthquake that hit the country on Monday, and hope to make sure those impacted are supported.
Memori… [+3422 chars]",,"Mitglieder der philippinischen Gemeinde in N.L. sind nach dem Erdbeben schockiert und untröstlich. Mitglieder der philippinischen Gemeinde in Neufundland und Labrador waren am Boden zerstört, als sie von dem tödlichen Erdbeben erfuhren, das das Land am Montag heimgesucht hat, und hoffen, dass die Betroffenen unterstützt werden.","Members of N.L.'s Filipino community shocked, heartbroken following earthquake. Members of Newfoundland and Labrador's Filipino community were devastated to learn of the deadly earthquake that hit the country on Monday, and hope to make sure those impacted are supported.","Sodales Communitatis Filipino N.L. consternati, taetrum sequente terrae motu. Socii Newfoundland et Labrador communitas Filipino vastaverunt ut discant terrae motus funestissimi, qui regionem die Lunae feriunt, et sperant certam iis impactibus sustentatam esse.",2026-06-13 15:21:34+00:00
598375b2bc96922e71b6ff7b0766c2a3,2026-06-09T14:14:52Z,'earthquake death',www.news24.com,en,0.9,News24 | Aftershocks worry rescuers after 41 dead in major Philippines earthquake,"Doctors treated patients in tents set up under a scorching Philippine sun, including helping a young mother give birth, as the death toll from a major earthquake that collapsed buildings and sparked tsunami warnings topped 40.",https://www.news24.com/world/aftershocks-worry-rescuers-after-41-dead-in-major-philippines-earthquake-20260609-0338,https://news24cobalt.24.co.za/resources/02a6-20d3e26ddcd5-53ad6343021f-1000/format/inline/philippines_earthquake.jpeg,,<ul><li>The death toll from the Philippine earthquake has increased to 41.</li><li>Thousands are displaced and more than 450 are injured.</li><li>Thousands of people were ordered to evacuate in coast… [+4379 chars],,"News24 | Nachbeben beunruhigen Retter nach 41 Toten bei schwerem Erdbeben auf den Philippinen. Ärzte behandelten Patienten in Zelten, die unter der sengenden philippinischen Sonne aufgestellt waren, und halfen unter anderem einer jungen Mutter bei der Geburt, während die Zahl der Todesopfer bei einem schweren Erdbeben, das Gebäude zum Einsturz brachte und Tsunami-Warnungen auslöste, über 40 lag.","News24 | Aftershocks worry rescuers after 41 dead in major Philippines earthquake. Doctors treated patients in tents set up under a scorching Philippine sun, including helping a young mother give birth, as the death toll from a major earthquake that collapsed buildings and sparked tsunami warnings topped 40.","News24 | Aftershocks solliciti liberatores post 41 mortuos in maioribus Philippinis terrae motus. Medici aegros in tentoriis tractaverunt sub ardore Philippini solis, inter adiuvantes matrem juvenculae parientis, quasi mortem terrae motu maiore, qui aedificia corruerunt et tsunami monita cumulum 40 excusserunt.",2026-06-13 15:21:34+00:00
