index,published,keyword,domain,language,valid,title,description,url,image,archive,content,quote,de,en,la,added
028b5c1c13199dd570b9db2a60618337,2025-10-17T14:22:50Z,'earthquake death',www.loudersound.com,en,0.0,"“We played the song and then the earthquake alarms started ringing! They had to move the festival the next year because of that”: How In Flames made a death metal classic heavy enough to rock a 1,600-ton bridge","Pulling inspiration from his personal trials, singer Anders Fridén wrote the Gothenburg band’s must-play hit",https://www.loudersound.com/features/in-flames-story-behind-only-for-the-weak,https://cdn.mos.cms.futurecdn.net/Sn53dCxxAcfpXJadAiw3rX-1280-80.png,,"This article is originally from Metal Hammer issue 339, September 2020 (Image credit: Future)
“I have so many memories of this song,” In Flames frontman Anders Fridén smiles when asked about his ban… [+8984 chars]",,"„Wir spielten das Lied und dann fingen die Erdbebenalarme an zu klingeln! Aus diesem Grund mussten sie das Festival im nächsten Jahr verschieben“: Wie In Flames einen Death-Metal-Klassiker schwer genug machten, um eine 1.600 Tonnen schwere Brücke zum Beben zu bringen. Inspiriert von seinen persönlichen Prüfungen schrieb Sänger Anders Fridén den Must-Play-Hit der Göteborger Band","“We played the song and then the earthquake alarms started ringing! They had to move the festival the next year because of that”: How In Flames made a death metal classic heavy enough to rock a 1,600-ton bridge. Pulling inspiration from his personal trials, singer Anders Fridén wrote the Gothenburg band’s must-play hit","""Lusimus cantum et terrores terrae motus sonant! Festum proximo anno ob id movere debebant"": Quomodo In flamma classica metallica mortem fecit gravem satis ad pontem mille ton 1,600. Inspirationem trahens ex iudiciis personalibus, Anders Fridén cantor scripsit cohortem Gothenburgicam hit debere ludere",2025-10-24 04:56:15+00:00
7616490ad9a89254cc455b2a8cb3a23f,2025-10-23T08:01:00Z,'earthquake early warning',www.thestar.com.my,en,0.0,"MetMalaysia upgrading tsunami warning system for faster alert issuance, says Johari","KUALA LUMPUR: The Malaysian Meteorological Department (MetMalaysia) is upgrading the Malaysian Tsunami Early Warning System (SAATNM) to enable faster issuance of earthquake and tsunami alerts, the Dewan Rakyat was told Thursday (Oct 23). Read full story",https://www.thestar.com.my/news/nation/2025/10/23/metmalaysia-upgrading-tsunami-warning-system-for-faster-alert-issuance-says-johari,https://apicms.thestar.com.my/uploads/images/2025/10/23/3584218.JPG,,"KUALA LUMPUR: The Malaysian Meteorological Department (MetMalaysia) is upgrading the Malaysian Tsunami Early Warning System (SAATNM) to enable faster issuance of earthquake and tsunami alerts, the De… [+2220 chars]",,"MetMalaysia modernisiert das Tsunami-Warnsystem für eine schnellere Alarmierung, sagt Johari. KUALA LUMPUR: Das malaysische Wetteramt (MetMalaysia) rüstet das malaysische Tsunami-Frühwarnsystem (SAATNM) auf, um eine schnellere Ausgabe von Erdbeben- und Tsunami-Warnungen zu ermöglichen, wurde dem Dewan Rakyat am Donnerstag (23. Oktober) mitgeteilt. Lesen Sie die ganze Geschichte","MetMalaysia upgrading tsunami warning system for faster alert issuance, says Johari. KUALA LUMPUR: The Malaysian Meteorological Department (MetMalaysia) is upgrading the Malaysian Tsunami Early Warning System (SAATNM) to enable faster issuance of earthquake and tsunami alerts, the Dewan Rakyat was told Thursday (Oct 23). Read full story","MetMalaysia upgradatio tsunami ratio admonitionis ut celerius editae alacer, dicit Johari. KUALA LUMPUR: Department of Malaysian Meteorologicum (MetMalaysia) upgradationem Tsunami Malaysian Systema praemature (SAATNM) ut citius editae terrae motuum et tsunami erectorum, Dewan Rakyat nuntiata est Iovis (23 Oct). Read full story",2025-10-24 04:56:15+00:00
de64d73fc1540e6db0553c7f7320cd61,2025-10-27T14:47:44Z,'earthquake magnitude',www.bostonherald.com,en,0.0,Two strong quakes in the Atlantic Ocean rattle the eastern Caribbean,A 6.5 magnitude earthquake has struck in open waters of the Atlantic Ocean and was felt throughout the eastern Caribbean.,https://www.bostonherald.com/2025/10/27/atlantic-ocean-earthquakes-rattle-caribbean/,https://www.bostonherald.com/wp-content/uploads/2025/02/GettyImages-1372845394-1.jpg?w=1024&h=660,,"SAN JUAN, Puerto Rico (AP) A 6.5 magnitude earthquake struck Monday in open waters in the Atlantic Ocean and was felt throughout the eastern Caribbean, officials said.
The quake occurred about 100 m… [+447 chars]",,"Zwei starke Erdbeben im Atlantischen Ozean erschüttern die östliche Karibik. Ein Erdbeben der Stärke 6,5 ereignete sich in den offenen Gewässern des Atlantischen Ozeans und war in der gesamten östlichen Karibik zu spüren.",Two strong quakes in the Atlantic Ocean rattle the eastern Caribbean. A 6.5 magnitude earthquake has struck in open waters of the Atlantic Ocean and was felt throughout the eastern Caribbean.,Duae motus validi in Oceano Atlantico crepitant Orientale Caribbean. Magnitudo terrae motus in aquis apertis Oceani Atlantici percussit et per totum Caribbean orientalis sentitur.,2025-10-24 04:56:15+00:00
b0f7c11e207395d6ec032c11a6666e0a,2025-10-27T18:36:03Z,'earthquake',phys.org,en,0.0,New earthquake model goes against the grain,"When a slab slides beneath an overriding plate in a subduction zone, the slab takes on a property called anisotropy, meaning its strength is not the same in all directions. Anisotropy is what causes a wooden board to break more easily along the grain than in …",https://phys.org/news/2025-10-earthquake-grain.html,https://scx2.b-cdn.net/gfx/news/hires/2025/new-earthquake-model-g.jpg,,"When a slab slides beneath an overriding plate in a subduction zone, the slab takes on a property called anisotropy, meaning its strength is not the same in all directions. Anisotropy is what causes … [+3186 chars]",,"Neues Erdbebenmodell geht gegen den Strich. Wenn eine Platte in einer Subduktionszone unter eine darüber liegende Platte gleitet, nimmt die Platte eine Eigenschaft namens Anisotropie an, was bedeutet, dass ihre Festigkeit nicht in alle Richtungen gleich ist. Anisotropie führt dazu, dass ein Holzbrett entlang der Faserrichtung leichter bricht als in …","New earthquake model goes against the grain. When a slab slides beneath an overriding plate in a subduction zone, the slab takes on a property called anisotropy, meaning its strength is not the same in all directions. Anisotropy is what causes a wooden board to break more easily along the grain than in …","Novum terrae motus exemplum contra granum accedit. Cum tabula sub summa lamina in subductione zona labitur, tabula in proprietatem anisotropiam vocatam accipit, cuius vis eius in omnes partes non eadem significat. Anisotropia est quae tabula lignea in frumentum facilius frangitur quam in ...",2025-10-24 04:56:15+00:00
3c2f51d49e6678b952ef83f84ae1d24e,2025-10-27T23:23:12Z,'earthquake',www.israelnationalnews.com,en,0.0,"Strong earthquake hits western Turkey, buildings collapse in Sindirgi","6.1 magnitude earthquake hits western Turkey, collapsing damaged buildings in Sindirgi. No deaths reported.",https://www.israelnationalnews.com/news/416919,https://2.a7.org/files/pictures/000/1106983.jpg,,"A powerful earthquake struck western Turkey late Monday night, causing several previously damaged buildings to collapse in the town of Sindirgi, located in Balikesir province, reported the Associated… [+1138 chars]",,"Starkes Erdbeben erschüttert Westtürkei, Gebäude stürzen in Sindirgi ein. Erdbeben der Stärke 6,1 erschüttert den Westen der Türkei und lässt beschädigte Gebäude in Sindirgi einstürzen. Es wurden keine Todesfälle gemeldet.","Strong earthquake hits western Turkey, buildings collapse in Sindirgi. 6.1 magnitude earthquake hits western Turkey, collapsing damaged buildings in Sindirgi. No deaths reported.","Terrae motus validus Turciam occidentalem ferit, aedificia in Sindirgi ruina. 6.1 Magnitudo terrae motus Turciae occidentalis pervenit, aedificia laesa in Sindirgi ruere. funera nulla nuntiata sunt.",2025-10-24 04:56:15+00:00
2b841bc0fca171512bea544e957cceba,2025-10-28T05:51:14Z,'earthquake damage',www.hurriyetdailynews.com,en,0.0,"6.1 magnitude earthquake strikes western Türkiye, no fatalities reported","A 6.1 magnitude earthquake struck the Sındırgı district of Türkiye's Western province of Balıkesir on Monday evening, causing structural damage but no loss of life, according to official reports.",https://www.hurriyetdailynews.com/6-1-magnitude-earthquake-strikes-western-turkiye-no-fatalities-reported-215094,https://image.hurimg.com/i/hurriyet/75/200x200/690059c856617a12eccf638f.jpg,,"BALIKESR
A 6.1 magnitude earthquake struck the Sndrg district of Türkiye's western province of Balkesir on Monday evening, causing structural damage but no loss of life, according to official report… [+2230 chars]",,"Erdbeben der Stärke 6,1 erschüttert Westtürkiye, es wurden keine Todesopfer gemeldet. Ein Erdbeben der Stärke 6,1 erschütterte am Montagabend den Bezirk Sındırgı in der westlichen türkischen Provinz Balıkesir und verursachte laut offiziellen Berichten strukturelle Schäden, aber keine Todesopfer.","6.1 magnitude earthquake strikes western Türkiye, no fatalities reported. A 6.1 magnitude earthquake struck the Sındırgı district of Türkiye's Western province of Balıkesir on Monday evening, causing structural damage but no loss of life, according to official reports.","6.1 Magnitudo terrae motus occidentis Türkiye pulsat, nulla fata retulerunt. Magnitudo terrae motus 6.1 Sındırgı pagum Türkiye provinciae occidentalis Balıkesir die Lunae vesperi percussit, detrimentum structurae causans sed nullum vitae detrimentum, secundum officiales relationes.",2025-10-24 04:56:15+00:00
ac5e0f2da31116ba6f1515f9ded7b362,2025-10-28T12:00:00Z,'earthquake',blog.cloudflare.com,en,0.0,Online outages: Q3 2025 Internet disruption summary,"In Q3 2025, we observed Internet disruptions around the world resulting from government directed shutdowns, power outages, cable cuts, a cyberattack, an earthquake, a fire, and technical problems, as well as several with unexplained causes.",https://blog.cloudflare.com/q3-2025-internet-disruption-summary/,https://cf-assets.www.cloudflare.com/zkvhlag99gkb/1wEoKEJZSWnndKIgDvFYVL/f7d1f8a404a0da258af75be8a9dc6783/Online_outages-_Q3_2025_Internet_disruption_summary-OG.png,,"In the third quarter, we observed Internet disruptions with a wide variety of known causes, as well as several with no definitive or published cause
. Once again, we unfortunately saw a number of go… [+27506 chars]",,"Online-Ausfälle: Zusammenfassung der Internetunterbrechungen im dritten Quartal 2025. Im dritten Quartal 2025 beobachteten wir weltweit Internetunterbrechungen, die auf behördlich angeordnete Abschaltungen, Stromausfälle, Kabelunterbrechungen, einen Cyberangriff, ein Erdbeben, einen Brand und technische Probleme sowie mehrere mit ungeklärten Ursachen zurückzuführen waren.","Online outages: Q3 2025 Internet disruption summary. In Q3 2025, we observed Internet disruptions around the world resulting from government directed shutdowns, power outages, cable cuts, a cyberattack, an earthquake, a fire, and technical problems, as well as several with unexplained causes.","Online outages: Q3 2025 Discidium interretialium summarium. In Q3 2025 animadvertimus interretialem perturbationem circa mundum, ex gubernatione quae shutdowns consequitur, potentiam outages, funem secare, cyberattack, terrae motum, ignem, et technicas quaestiones, ac nonnullas cum causis explicatis.",2025-10-24 04:56:15+00:00
a51a40dbb8a2c7a107e100156c14a0b1,2025-10-28T23:28:07Z,'earthquake evacuation',variety.com,en,0.0,Sci-Fi Western ‘Hum’ Heads to Tokyo Gap-Financing Market,"Don Josephus Raphael Eblahan’s “Hum” is making its pitch at the Tokyo Gap-Financing Market. After a devastating earthquake, a young veterinarian works at an evacuation center to treat injured farm animals. While caring for them, her professor discovers someth…",https://variety.com/2025/film/markets-festivals/sci-fi-western-hum-tokyo-gap-financing-market-1236564056/,https://variety.com/wp-content/uploads/2025/10/Hum.jpg?w=1000&h=563&crop=1,,"Don Josephus Raphael Eblahan’s “Hum” is making its pitch at the Tokyo Gap-Financing Market.
After a devastating earthquake, a young veterinarian works at an evacuation center to treat injured farm a… [+4650 chars]",,"Science-Fiction-Western „Hum“ macht sich auf den Weg zum Gap-Financing-Markt in Tokio. Don Josephus Raphael Eblahans „Hum“ macht seinen Pitch auf dem Tokyo Gap-Financing Market. Nach einem verheerenden Erdbeben arbeitet ein junger Tierarzt in einem Evakuierungszentrum, um verletzte Nutztiere zu behandeln. Während sie sich um sie kümmert, entdeckt ihr Professor etwas ...","Sci-Fi Western ‘Hum’ Heads to Tokyo Gap-Financing Market. Don Josephus Raphael Eblahan’s “Hum” is making its pitch at the Tokyo Gap-Financing Market. After a devastating earthquake, a young veterinarian works at an evacuation center to treat injured farm animals. While caring for them, her professor discovers someth…","Sci-Fi Western 'Hum' Capitula ad Tokyo Gap-Financing Market. Don Josephus Raphael Eblahan scriptor ""Hum"" suam picem facit in Foro Tokyo Gap-Financing. Post vastitatem terrae motus iuvenis VETERINARIUS opera media evacuationis ad pecudes laesae tractandum est. Dum eas curat, professor aliquid invenit.",2025-10-24 04:56:15+00:00
453466854168fce542d0739004791f8c,2025-10-29T14:00:00Z,'earthquake disaster',journals.plos.org,en,0.0,"Analysis of disaster-affected population mobility through grid-aggregated mobile location data: The 2017 Jiuzhaigou earthquake, China","In disaster research, individual-level mobile phone location data is considered highly valuable for assessing population mobility and disaster impacts. However, due to privacy regulations in China, only spatially aggregated mobile data with a resolution of 1 …",https://journals.plos.org/plosone/article?id=10.1371/journal.pone.0335415,https://journals.plos.org/plosone/article/figure/image?id=10.1371/journal.pone.0335415.g005&size=inline,,"Abstract
In disaster research, individual-level mobile phone location data is considered highly valuable for assessing population mobility and disaster impacts. However, due to privacy regulations i… [+37440 chars]",,"Analyse der von Katastrophen betroffenen Bevölkerungsmobilität anhand netzaggregierter mobiler Standortdaten: Das Jiuzhaigou-Erdbeben 2017, China. In der Katastrophenforschung gelten individuelle Mobilfunkstandortdaten als äußerst wertvoll für die Beurteilung der Bevölkerungsmobilität und der Auswirkungen von Katastrophen. Allerdings werden aufgrund der Datenschutzbestimmungen in China nur räumlich aggregierte Mobilfunkdaten mit einer Auflösung von 1 …","Analysis of disaster-affected population mobility through grid-aggregated mobile location data: The 2017 Jiuzhaigou earthquake, China. In disaster research, individual-level mobile phone location data is considered highly valuable for assessing population mobility and disaster impacts. However, due to privacy regulations in China, only spatially aggregated mobile data with a resolution of 1 …","Analysis calamitatis affectatae mobilitatis incolarum per locum mobilem coacervatum datae: Terrae motus 2017 Jiuzhaigou, Sinarum. In calamitate investigationis singulae gradus telephonici mobiles locus notitiae magni pretii aestimantur ad motum et calamitatem impactorum hominum perpendendos. Attamen, ob normas secretas in Sinis, spatia tantum data mobilia aggregata cum solutione 1 …",2025-10-24 04:56:15+00:00
b4428e44c5db337cab54487ff529f3f6,2025-10-29T14:00:00Z,'earthquake',www.core77.com,en,0.0,Automated Drone Docks for Disaster Relief and Catching Criminals,"Last year a 7.6 earthquake hit Japan's Noto Peninsula, generating a 37-foot tsunami. Hundreds of aftershocks, nearly a thousand mudslides and rampant fires ripped through the region, damaging or destroying over 200,000 structures. Nearly 700 people died, a fu…",https://www.core77.com/posts/139083/Automated-Drone-Docks-for-Disaster-Relief-and-Catching-Criminals,https://s3files.core77.com/blog/images/lead_n_spotlight/1771569_lead_400_139083_.jpg,,"Last year a 7.6 earthquake hit Japan's Noto Peninsula, generating a 37-foot tsunami. Hundreds of aftershocks, nearly a thousand mudslides and rampant fires ripped through the region, damaging or dest… [+2267 chars]",,"Automatisierte Drohnendocks zur Katastrophenhilfe und zur Festnahme von Kriminellen. Letztes Jahr erschütterte ein Erdbeben der Stärke 7,6 die japanische Halbinsel Noto und löste einen 37 Fuß hohen Tsunami aus. Hunderte Nachbeben, fast tausend Erdrutsche und grassierende Brände erschütterten die Region und beschädigten oder zerstörten über 200.000 Bauwerke. Fast 700 Menschen starben, eine Menge …","Automated Drone Docks for Disaster Relief and Catching Criminals. Last year a 7.6 earthquake hit Japan's Noto Peninsula, generating a 37-foot tsunami. Hundreds of aftershocks, nearly a thousand mudslides and rampant fires ripped through the region, damaging or destroying over 200,000 structures. Nearly 700 people died, a fu…","Automated Drone Docks for Disaster Relief and Catching Criminals. Ultimus annus a 7.6 terrae motus Noto paeninsulam Iaponiae percussit, quod 37-pedem tsunami generans. Centum aftershocks, incendia fere mille turbata et erecti per regionem evulsa, deminutio vel destruens supra 200,000 structuras. Fere DCC homines mortui sunt, a fu…",2025-10-24 04:56:15+00:00
1e2d54b3367cb3db16b188e9f777482d,2025-10-30T05:34:55Z,'earthquake',www.syllad.com,en,0.0,"7 lakh Assam students ‘drop, cover, hold on’ in mega earthquake-fire drill","At exactly 10:16 a.m. on October 16, desks rattled, alarms blared, and over 700,000 children across Assam dropped to the floor, slid under tables, and gripped the legs tight. It wasn’t a real quake—but the Great Assam School Shakeout Programme (GASSP) made it…",https://www.syllad.com/7-lakh-assam-students-drop-cover-hold-on-in-mega-earthquake-fire-drill/,https://www.syllad.com/wp-content/uploads/2025/10/Mockdrill.jpg,,"Syllad | The Rising MeghalayaOctober 30, 2025

At exactly 10:16 a.m. on October 16, desks rattled, alarms blared, and over 700,000 children across Assam dropped to the floor, slid under tables, and g… [+1782 chars]",,"7 Lakh Assam-Studenten „lassen sich fallen, verstecken sich, halten sich fest“ bei einer Mega-Erdbeben-Brandübung. Pünktlich um 10:16 Uhr am 16. Oktober klapperten Schreibtische, Alarme ertönten und über 700.000 Kinder in ganz Assam ließen sich auf den Boden fallen, rutschten unter Tische und umklammerten die Beine fest. Es war kein echtes Beben – aber das Great Assam School Shakeout Program (GASSP) hat es geschafft …","7 lakh Assam students ‘drop, cover, hold on’ in mega earthquake-fire drill. At exactly 10:16 a.m. on October 16, desks rattled, alarms blared, and over 700,000 children across Assam dropped to the floor, slid under tables, and gripped the legs tight. It wasn’t a real quake—but the Great Assam School Shakeout Programme (GASSP) made it…","7 lakh Assam discipuli 'gutta, cover', retine in mega terebra terrae motus. Ad exacte 10:16 a.m. die XVI mensis Octobris, tabulae crepuerunt, terrores insonuerunt, et supra 700.000 filii trans Assam in pavimento delapsi sunt, sub tabulis delapsi, et crura stricta tenuerunt. Motus verus non erat, sed Magnus Assam School Shakeout Programma (GASSP) fecit…",2025-10-24 04:56:15+00:00
48a9ec515b44674f255d0bd768dd4113,2025-10-30T14:28:44Z,'earthquake disaster',www.artofmanliness.com,en,0.0,What to Pack in a Get Home Bag,"When disaster strikes while you’re away from home — whether it’s a blizzard that strands your car, a citywide blackout, or an earthquake that knocks out cell service — the only thing that really matters is getting safely back home. That’s where a get home bag…",https://www.artofmanliness.com/skills/get-home-bag-supplies/,https://content.artofmanliness.com/uploads/2025/10/pack.jpg,,"When disaster strikes while youre away from home whether its a blizzard that strands your car, a citywide blackout, or an earthquake that knocks out cell service the only thing that really matters is… [+1011 chars]",,"Was Sie in eine Get-Home-Tasche packen sollten. Wenn eine Katastrophe eintritt, während Sie nicht zu Hause sind – sei es ein Schneesturm, der Ihr Auto zum Stillstand bringt, ein Stromausfall in der ganzen Stadt oder ein Erdbeben, das den Mobilfunkempfang lahmlegt – ist das Einzige, was wirklich zählt, sicher nach Hause zurückzukehren. Da ist eine Get-Home-Tasche …","What to Pack in a Get Home Bag. When disaster strikes while you’re away from home — whether it’s a blizzard that strands your car, a citywide blackout, or an earthquake that knocks out cell service — the only thing that really matters is getting safely back home. That’s where a get home bag…","Quid stipare in Domum Get Bag. Cum calamitas percutit dum domi absis — num blizzard est qui contorto tuo curru, niger urbe, vel terrae motu qui cellam pulsaverit — nulla res est quae domum remittit incolumis. Id est ubi sacculum domum perveniam…",2025-10-24 04:56:15+00:00
8097d4b8986d219af4ffa753fb1265da,2025-10-30T16:40:04Z,'earthquake',phys.org,en,0.0,Turning smartphones into earthquake sensors,"The impact of an earthquake on people and property depends not only on the earthquake's characteristics like magnitude and depth, but also on local soil conditions, which contribute to the so-called ""site effect."" Mapping the site effect at a high spatial res…",https://phys.org/news/2025-10-smartphones-earthquake-sensors.html,https://scx2.b-cdn.net/gfx/news/hires/2025/turning-smartphones-in.jpg,,"The impact of an earthquake on people and property depends not only on the earthquake's characteristics like magnitude and depth, but also on local soil conditions, which contribute to the so-called … [+5805 chars]",,"Smartphones in Erdbebensensoren verwandeln. Die Auswirkungen eines Erdbebens auf Menschen und Eigentum hängen nicht nur von den Erdbebeneigenschaften wie Stärke und Tiefe ab, sondern auch von den örtlichen Bodenbedingungen, die zum sogenannten „Standorteffekt“ beitragen. Kartierung des Standorteffekts mit hoher räumlicher Auflösung…","Turning smartphones into earthquake sensors. The impact of an earthquake on people and property depends not only on the earthquake's characteristics like magnitude and depth, but also on local soil conditions, which contribute to the so-called ""site effect."" Mapping the site effect at a high spatial res…","Suspendisse in vertens sensoriis terrae motus. Ictus terrae motus in homines et proprietates non solum pendet a notis terrae motui sicut magnitudinis et profunditatis, sed etiam a solo locali condiciones, quae ad sic dictum ""situm effectum"" conferunt. Locus mapping effectus in alta res locali…",2025-10-24 04:56:15+00:00
374435890fbfce5ea04b76dd13104566,2025-10-30T17:08:00Z,'earthquake',www.scientificamerican.com,en,0.0,Seismometers Picked Up Hurricane Melissa’s Historic Power Like an Earthquake,"Seismometers picked up the ferocious winds and waves of Hurricane Melissa, showing how the tools can be used to better understand storms today and those from the past",https://www.scientificamerican.com/article/seismometers-picked-up-hurricane-melissas-historic-power-like-an-earthquake/,https://static.scientificamerican.com/dam/m/4ee3d32444c04b65/original/seismometer-images_d.png?m=1761845545.602&w=1200,,"Hurricane Melissa will go down as one of the worst hurricanes ever in the Atlantic Ocean, with the hurricane reaching a strength that only a handful of storms have achieved in recorded history. Melis… [+4738 chars]",,"Seismometer erfassten die historische Kraft des Hurrikans Melissa wie ein Erdbeben. Seismometer erfassten die heftigen Winde und Wellen des Hurrikans Melissa und zeigten, wie die Werkzeuge genutzt werden können, um heutige und vergangene Stürme besser zu verstehen","Seismometers Picked Up Hurricane Melissa’s Historic Power Like an Earthquake. Seismometers picked up the ferocious winds and waves of Hurricane Melissa, showing how the tools can be used to better understand storms today and those from the past","Seismometers Rapta Procellae Melissae Historico Potestate Similis Terrae motus. Seismometers feroces ventos et fluctus Melissae Turbo sustulit, ostendens quomodo instrumenta hodie et ex praeteritis tempestatibus melius uti possint.",2025-10-24 04:56:15+00:00
